symbol,description,exchange,sector,industry,open,high,low,Close,Change%,MarketCap,Volume,Currency
SHR.R,"S Hotels & Resorts Public Co., Ltd. NVDR",SET,Consumer Services,Hotels/Resorts/Cruise lines,1.47,1.52,1.47,1.49,1.360544217687076,5354523474.0,1470600,THB
SIA19,Singapore Airlines Ltd Units Thailand Depository Receipt Repr 0.01 Sh,SET,Transportation,Airlines,16.6,16.6,16.5,16.6,0.0,512476397285.0081,11706,THB
SIAM,Siam Steel International Public Co. Ltd.,SET,Producer Manufacturing,Office Equipment/Supplies,0.71,0.74,0.71,0.74,0.0,438913093.0,13717,THB
SIAM.R,Siam Steel International Public Co. Ltd. NVDR,SET,Producer Manufacturing,Office Equipment/Supplies,0.71,0.74,0.71,0.74,0.0,438913093.0,13700,THB
SICT,"Silicon Craft Technology Public Co., Ltd.",SET,Electronic Technology,Semiconductors,2.62,2.64,2.58,2.6,-0.7633587786259549,1247999954.0,285000,THB
SICT.R,"Silicon Craft Technology Public Co., Ltd. NVDR",SET,Electronic Technology,Semiconductors,2.62,2.64,2.58,2.6,-0.7633587786259549,1247999954.0,285000,THB
SIMAT,Simat Technologies Public Co. Ltd.,SET,Commercial Services,Commercial Printing/Forms,1.09,1.1,1.07,1.09,0.9259259259259267,706935475.0,2178550,THB
SIMAT.R,Simat Technologies Public Co. Ltd. NVDR,SET,Commercial Services,Commercial Printing/Forms,1.09,1.1,1.07,1.09,0.9259259259259267,706935475.0,2178500,THB
SINGER,Singer Thailand Public Co. Ltd.,SET,Distribution Services,Wholesale Distributors,5.85,6.3,5.85,6.2,6.896551724137938,5028537016.0,13337973,THB
SINGER.R,Singer Thailand Public Co. Ltd. NVDR,SET,Distribution Services,Wholesale Distributors,5.85,6.3,5.85,6.2,6.896551724137938,5028537016.0,13337800,THB
SINGTEL80,Singapore Telecommunications Limited UNITS Thailand Depository Receipt Repr 0.1 Sh,SET,Communications,Major Telecommunications,11.0,11.0,10.9,11.0,0.0,1816390483089.4143,24825,THB
SINO,Sino Logistics Corporation Public Company Limited,SET,Transportation,Airlines,1.01,1.03,1.01,1.02,0.990099009900991,1060800000.0,357950,THB
SINO.R,Sino Logistics Corporation Public Company Limited NVDR,SET,Transportation,Airlines,1.01,1.03,1.01,1.02,0.990099009900991,1060800000.0,357900,THB
SIRI,Sansiri Public Co. Ltd.,SET,Finance,Real Estate Development,1.44,1.48,1.42,1.48,3.4965034965034993,25786369864.0,65979215,THB
SIRI.R,Sansiri Public Co. Ltd. NVDR,SET,Finance,Real Estate Development,1.44,1.48,1.42,1.48,3.4965034965034993,25786369864.0,65976600,THB
SIRIPRT,Siripinyo Real Estate Investment Trust,SET,Finance,Real Estate Investment Trusts,7.85,7.85,7.75,7.75,0.0,,3800,THB
SIS,"SIS Distribution (Thailand) Public Co., Ltd.",SET,Distribution Services,Electronics Distributors,21.6,21.9,21.5,21.8,0.9259259259259226,7634330726.0,136107,THB
SIS.R,"SIS Distribution (Thailand) Public Co., Ltd. NVDR",SET,Distribution Services,Electronics Distributors,21.6,21.9,21.5,21.8,0.9259259259259226,7634330726.0,136100,THB
SISB,"SISB Public Co., Ltd.",SET,Consumer Services,Other Consumer Services,13.6,14.2,13.6,14.0,2.941176470588238,13160000000.0,9006980,THB
SISB.R,"SISB Public Co., Ltd. NVDR",SET,Consumer Services,Other Consumer Services,13.6,14.2,13.6,14.0,2.941176470588238,13160000000.0,9006800,THB
SITHAI,Srithai Superware Public Co. Ltd.,SET,Producer Manufacturing,Miscellaneous Manufacturing,1.06,1.06,1.04,1.06,0.9523809523809532,2794962354.0,45400,THB
SITHAI.R,Srithai Superware Public Co. Ltd. NVDR,SET,Producer Manufacturing,Miscellaneous Manufacturing,1.06,1.06,1.04,1.06,0.9523809523809532,2794962354.0,45400,THB
SJWD,SCGJWD Logistics Public Company Limited,SET,Transportation,Other Transportation,10.0,10.3,10.0,10.2,3.030303030303019,18472406344.0,2030297,THB
SJWD.R,SCGJWD Logistics Public Company Limited NVDR,SET,Transportation,Other Transportation,10.0,10.3,10.0,10.2,3.030303030303019,18472406344.0,2030000,THB
SK,Sirakorn Public Co Limited,SET,Non-Energy Minerals,Construction Materials,0.61,0.61,0.59,0.61,0.0,280600007.0,823500,THB
SK.R,Sirakorn Public Co Limited NVDR,SET,Non-Energy Minerals,Construction Materials,0.61,0.61,0.59,0.61,0.0,280600007.0,823500,THB
SKE,Sakol Energy Public Company Ltd,SET,Utilities,Electric Utilities,0.22,0.23,0.22,0.22,0.0,245519999.0,259500,THB
SKE.R,Sakol Energy Public Company Ltd NVDR,SET,Utilities,Electric Utilities,0.22,0.23,0.22,0.22,0.0,245519999.0,259500,THB
SKN,S.Kijchai Enterprise Public Company Ltd,SET,Non-Energy Minerals,Forest Products,5.65,5.65,5.65,5.65,-0.8771929824561372,4520000076.0,17206,THB
SKN.R,S.Kijchai Enterprise Public Company Ltd NVDR,SET,Non-Energy Minerals,Forest Products,5.65,5.65,5.65,5.65,-0.8771929824561372,4520000076.0,17200,THB
SKR,"Sikarin Public Co., Ltd.",SET,Health Services,Hospital/Nursing Management,8.2,8.25,8.15,8.25,0.6097560975609843,16939961060.000002,391301,THB
SKR.R,"Sikarin Public Co., Ltd. NVDR",SET,Health Services,Hospital/Nursing Management,8.2,8.25,8.15,8.25,0.6097560975609843,16939961060.000002,391300,THB
SKY,Sky ICT Public Company Ltd,SET,Technology Services,Information Technology Services,14.2,14.9,14.2,14.8,4.225352112676067,10615741860.0,1662860,THB
SKY.R,Sky ICT Public Company Ltd NVDR,SET,Technology Services,Information Technology Services,14.2,14.9,14.2,14.8,4.225352112676067,10615741860.0,1662500,THB
SLP,Salee Printing Co. Ltd.,SET,Commercial Services,Commercial Printing/Forms,0.45,0.45,0.45,0.45,0.0,539999986.0,10300,THB
SLP.R,Salee Printing Co. Ltd. NVDR,SET,Commercial Services,Commercial Printing/Forms,0.45,0.45,0.45,0.45,0.0,539999986.0,10300,THB
SMART,Smart Concrete Public Company Ltd,SET,Non-Energy Minerals,Construction Materials,0.58,0.61,0.58,0.6,3.448275862068969,624940015.0,3572500,THB
SMART.R,Smart Concrete Public Company Ltd NVDR,SET,Non-Energy Minerals,Construction Materials,0.58,0.61,0.58,0.6,3.448275862068969,624940015.0,3572500,THB
SMD100,SMD Rise Public Company Limited,SET,Distribution Services,Medical Distributors,3.82,3.84,3.82,3.84,0.5235602094240842,862847969.0,10755,THB
SMD100.R,SMD Rise Public Company Limited NVDR,SET,Distribution Services,Medical Distributors,3.82,3.84,3.82,3.84,0.5235602094240842,862847969.0,10600,THB
SMFG19,"Sumitomo Mitsui Financial Group, Inc. Units Thailand Depository Receipt Repr 0.003333333 Sh",SET,Finance,Major Banks,8.8,8.9,8.8,8.9,0.0,3429427254739.8643,28003,THB
SMIC23,Semiconductor Manufacturing International Corp. Units Thailand Depositery Receipts Repr 0.01 Sh,SET,Electronic Technology,Semiconductors,2.84,2.94,2.76,2.88,4.347826086956526,2493702258320.8403,12924285,THB
SMIT,"Sahamit Machinery Public Co., Ltd.",SET,Distribution Services,Wholesale Distributors,3.56,3.58,3.54,3.58,0.5617977528089892,1897399960.0,26299,THB
SMIT.R,"Sahamit Machinery Public Co., Ltd. NVDR",SET,Distribution Services,Wholesale Distributors,3.56,3.58,3.54,3.58,0.5617977528089892,1897399960.0,26200,THB
SMPC,Sahamitr Pressure Container Public Co. Ltd.,SET,Process Industries,Containers/Packaging,9.05,9.05,9.0,9.05,0.5555555555555635,4846331996.0,6821,THB
SMPC.R,Sahamitr Pressure Container Public Co. Ltd. NVDR,SET,Process Industries,Containers/Packaging,9.05,9.05,9.0,9.05,0.5555555555555635,4846331996.0,6800,THB
SMT,Stars Microelectronics (Thailand) Public Co. Ltd.,SET,Electronic Technology,Semiconductors,1.4,1.43,1.39,1.39,0.0,1175361811.0,1110001,THB
SMT.R,Stars Microelectronics (Thailand) Public Co. Ltd. NVDR,SET,Electronic Technology,Semiconductors,1.4,1.43,1.39,1.39,0.0,1175361811.0,1110000,THB
SNC,"SNC Former Public Co., Ltd.",SET,Producer Manufacturing,Metal Fabrication,5.9,5.9,5.8,5.9,0.0,2137100022.0,60541,THB
SNC.R,"SNC Former Public Co., Ltd. NVDR",SET,Producer Manufacturing,Metal Fabrication,5.9,5.9,5.8,5.9,0.0,2137100022.0,60500,THB
SNNP,Srinanaporn Marketing Public Company Limited,SET,Consumer Non-Durables,Food: Specialty/Candy,9.6,9.8,9.55,9.8,1.5544041450777237,9408000183.0,740960,THB
SNNP.R,Srinanaporn Marketing Public Company Limited NVDR,SET,Consumer Non-Durables,Food: Specialty/Candy,9.6,9.8,9.55,9.8,1.5544041450777237,9408000183.0,740700,THB
SNP,S&P Syndicate Public Co. Ltd.,SET,Consumer Services,Restaurants,9.8,9.9,9.8,9.9,0.0,5063976093.0,26768,THB
SNP.R,S&P Syndicate Public Co. Ltd. NVDR,SET,Consumer Services,Restaurants,9.8,9.9,9.8,9.9,0.0,5063976093.0,26700,THB
SNPS,Specialty Natural Products Public Company Limited,SET,Health Technology,Pharmaceuticals: Other,4.32,4.4,4.3,4.4,1.3824884792626844,1782000000.0,117800,THB
SNPS.R,Specialty Natural Products Public Company Limited NVDR,SET,Health Technology,Pharmaceuticals: Other,4.32,4.4,4.3,4.4,1.3824884792626844,,117800,THB
SO,SiamRajathanee Public Company Limited,SET,Commercial Services,Miscellaneous Commercial Services,4.48,4.48,4.42,4.48,0.0,2133151981.9999998,6034,THB
SO.R,SiamRajathanee Public Company Limited NVDR,SET,Commercial Services,Miscellaneous Commercial Services,4.48,4.48,4.42,4.48,0.0,2133151981.9999998,6000,THB
SOLAR,Solartron Public Co. Ltd.,SET,Utilities,Alternative Power Generation,0.34,0.37,0.34,0.36,2.85714285714286,430946560.0,9635402,THB
SOLAR.R,Solartron Public Co. Ltd. NVDR,SET,Utilities,Alternative Power Generation,0.34,0.37,0.34,0.36,2.85714285714286,430946560.0,9635400,THB
SONIC,"Sonic Interfreight Public Co., Ltd.",SET,Transportation,Air Freight/Couriers,1.49,1.5,1.48,1.49,-0.6666666666666672,1080544569.0,468600,THB
SONIC.R,"Sonic Interfreight Public Co., Ltd. NVDR",SET,Transportation,Air Freight/Couriers,1.49,1.5,1.48,1.49,-0.6666666666666672,1080544569.0,468600,THB
SONY80,Sony Group Corporation Units Thailand Depository Receipt Repr 0.001 Sh,SET,Electronic Technology,Computer Processing Hardware,4.42,4.46,4.4,4.46,-0.4464285714285817,5447752564974.421,39186,THB
SORKON,S. Khonkaen Foods Public Co. Ltd.,SET,Distribution Services,Food Distributors,4.0,4.0,3.96,3.98,0.0,1287131982.0,64400,THB
SORKON.R,S. Khonkaen Foods Public Co. Ltd. NVDR,SET,Distribution Services,Food Distributors,4.0,4.0,3.96,3.98,0.0,1287131982.0,64400,THB
SP50001,Hang Seng Investment Index Funds Series IV - Hang Seng S&P 500 Index ETF units Thailand Depositary Receipt Repr 2 Shs,SET,Miscellaneous,Investment Trusts/Mutual Funds,21.2,21.4,21.0,21.1,0.0,,170729,THB
SPA,Siam Wellness Group Public Company Limited,SET,Consumer Services,Other Consumer Services,3.12,3.22,3.1,3.16,1.2820512820512833,4052697410.0,4956701,THB
SPA.R,Siam Wellness Group Public Company Limited NVDR,SET,Consumer Services,Other Consumer Services,3.12,3.22,3.1,3.16,1.2820512820512833,4052697410.0,4956600,THB
SPACK,"S. Pack & Print Public Co., Ltd.",SET,Commercial Services,Commercial Printing/Forms,1.4,1.4,1.4,1.4,0.0,419999993.0,200,THB
SPACK.R,"S. Pack & Print Public Co., Ltd. NVDR",SET,Commercial Services,Commercial Printing/Forms,1.4,1.4,1.4,1.4,0.0,419999993.0,200,THB
SPALI,"Supalai Public Co., Ltd.",SET,Finance,Real Estate Development,16.8,17.1,16.7,17.0,0.5917159763313694,29887961060.0,5431726,THB
SPALI.R,"Supalai Public Co., Ltd. NVDR",SET,Finance,Real Estate Development,16.8,17.1,16.7,17.0,0.5917159763313694,29887961060.0,5430900,THB
SPC,"Saha Pathanapibul Public Co., Ltd.",SET,Distribution Services,Food Distributors,57.25,57.5,57.25,57.5,0.0,18773098984.0,1232,THB
SPC.R,"Saha Pathanapibul Public Co., Ltd. NVDR",SET,Distribution Services,Food Distributors,57.25,57.5,57.25,57.5,0.0,18773098984.0,1200,THB
SPCG,SPCG Public Co. Ltd.,SET,Utilities,Alternative Power Generation,8.25,8.35,8.25,8.3,0.6060606060606146,8763057526.0,208584,THB
SPCG.R,SPCG Public Co. Ltd. NVDR,SET,Utilities,Alternative Power Generation,8.25,8.35,8.25,8.3,0.6060606060606146,8763057526.0,208400,THB
SPG,Siam Pan Group Public Co. Ltd.,SET,Process Industries,Industrial Specialties,12.3,12.4,12.3,12.4,-3.1250000000000027,4277999868.0,700,THB
SPG.R,Siam Pan Group Public Co. Ltd. NVDR,SET,Process Industries,Industrial Specialties,12.3,12.4,12.3,12.4,-3.1250000000000027,4277999868.0,700,THB
SPI,Saha Pathana Inter-Holding Public Co. Ltd.,SET,Finance,Real Estate Development,43.25,43.75,43.25,43.25,0.5813953488372093,37104157578.0,2201,THB
SPI.R,Saha Pathana Inter-Holding Public Co. Ltd. NVDR,SET,Finance,Real Estate Development,43.25,43.75,43.25,43.25,0.5813953488372093,37104157578.0,2200,THB
SPRC,Star Petroleum Refining Public Co. Ltd.,SET,Energy Minerals,Oil Refining/Marketing,4.78,4.86,4.7,4.82,1.6877637130801704,20899047688.0,37229093,THB
SPRC.R,Star Petroleum Refining Public Co. Ltd. NVDR,SET,Energy Minerals,Oil Refining/Marketing,4.78,4.86,4.7,4.82,1.6877637130801704,20899047688.0,37228600,THB
SPREME,Supreme Distribution Public Company Limited,SET,Distribution Services,Electronics Distributors,1.41,1.42,1.39,1.4,0.0,1036000000.0,162500,THB
SPREME.R,Supreme Distribution Public Company Limited NVDR,SET,Distribution Services,Electronics Distributors,1.41,1.42,1.39,1.4,0.0,1036000000.0,162500,THB
SPRIME,S Prime Growth Leasehold Real Estate Investment Trust,SET,Finance,Real Estate Investment Trusts,3.34,3.34,3.32,3.34,0.6024096385542175,1492145064.0,32810,THB
SPVI,S P V I Public Company Ltd,SET,Distribution Services,Electronics Distributors,2.38,2.42,2.36,2.4,1.6949152542372898,960000038.0,449500,THB
SPVI.R,S P V I Public Company Ltd NVDR,SET,Distribution Services,Electronics Distributors,2.38,2.42,2.36,2.4,1.6949152542372898,960000038.0,449500,THB
SQ,Sahakol Equipment Public Company Ltd,SET,Finance,Finance/Rental/Leasing,0.61,0.61,0.46,0.48,-26.15384615384616,551288249.0,19644234,THB
SQ.R,Sahakol Equipment Public Company Ltd NVDR,SET,Finance,Finance/Rental/Leasing,0.61,0.61,0.46,0.48,-26.15384615384616,551288249.0,19644000,THB
SR,Siamraj Public Company Limited,SET,Producer Manufacturing,Industrial Machinery,0.48,0.49,0.46,0.46,4.545454545454549,311282039.0,21000,THB
SR.R,Siamraj Public Company Limited NVDR,SET,Producer Manufacturing,Industrial Machinery,0.48,0.49,0.46,0.46,4.545454545454549,311282039.0,21000,THB
SRICHA,Sriracha Construction Public Co. Ltd.,SET,Industrial Services,Engineering & Construction,9.5,9.5,9.2,9.45,1.6129032258064364,2928356470.0,177904,THB
SRICHA.R,Sriracha Construction Public Co. Ltd. NVDR,SET,Industrial Services,Engineering & Construction,9.5,9.5,9.2,9.45,1.6129032258064364,2928356470.0,177900,THB
SRIPANWA,Sri Panwa Hospitality Real Estate Investment Trust,SET,Finance,Real Estate Investment Trusts,4.92,4.92,4.82,4.9,0.8230452674897125,1367413604.0,10700,THB
SRS,Sirisoft Public Company Limited,SET,Technology Services,Information Technology Services,2.6,2.7,2.6,2.64,1.5384615384615397,422400000.0,297000,THB
SRS.R,Sirisoft Public Company Limited NVDR,SET,Technology Services,Information Technology Services,2.6,2.7,2.6,2.64,1.5384615384615397,422400000.0,297000,THB
SSF,Surapon Foods Public Co. Ltd.,SET,Consumer Non-Durables,Food: Meat/Fish/Dairy,5.4,5.4,5.4,5.4,0.0,1457994588.0,1800,THB
SSF.R,Surapon Foods Public Co. Ltd. NVDR,SET,Consumer Non-Durables,Food: Meat/Fish/Dairy,5.4,5.4,5.4,5.4,0.0,1457994588.0,1800,THB
SSP,Sermsang Power Corp. Public Co. Ltd.,SET,Utilities,Alternative Power Generation,3.96,3.98,3.96,3.98,0.0,5109626245.0,76328,THB
SSP.R,Sermsang Power Corporation Public Company Ltd NVDR,SET,Utilities,Alternative Power Generation,3.96,3.98,3.96,3.98,0.0,5109626245.0,76300,THB
SSPF,Sala Sathorn Property Fund Units,SET,Miscellaneous,Investment Trusts/Mutual Funds,3.96,3.96,3.96,3.96,0.0,661320000.0,13500,THB
SSSC,"Siam Steel Service Center Public Co., Ltd.",SET,Non-Energy Minerals,Steel,2.14,2.14,2.1,2.12,-0.9345794392523372,1356795398.0,14644,THB
SSSC.R,"Siam Steel Service Center Public Co., Ltd. NVDR",SET,Non-Energy Minerals,Steel,2.14,2.14,2.1,2.12,-0.9345794392523372,1356795398.0,14600,THB
SST,"Sub Sri Thai Public Co., Ltd.",SET,Consumer Services,Restaurants,1.6,1.62,1.6,1.62,0.6211180124223608,852861975.0,1315,THB
SST.R,"Sub Sri Thai Public Co., Ltd. NVDR",SET,Consumer Services,Restaurants,1.6,1.62,1.6,1.62,0.6211180124223608,852861975.0,1300,THB
SSTRT,Sub Sri Thai Real Estate Investment Trust,SET,Finance,Real Estate Investment Trusts,4.36,4.36,4.36,4.36,0.0,833413999.0,18500,THB
STA,Sri Trang Agro-Industry Public Co. Ltd.,SET,Process Industries,Industrial Specialties,12.3,12.8,12.2,12.7,4.0983606557377055,19507199707.0,6798357,THB
STA.R,Sri Trang Agro-Industry Public Co. Ltd. NVDR,SET,Process Industries,Industrial Specialties,12.3,12.8,12.2,12.7,4.0983606557377055,19507199707.0,6797700,THB
STANLY,"Thai Stanley Electric Public Co., Ltd.",SET,Producer Manufacturing,Auto Parts: OEM,181.0,183.0,181.0,183.0,1.1049723756906076,14022375000.0,4232,THB
STANLY.R,"Thai Stanley Electric Public Co., Ltd. NVDR",SET,Producer Manufacturing,Auto Parts: OEM,181.0,183.0,181.0,183.0,1.1049723756906076,14022375000.0,4200,THB
STAR5001,Premia China STAR50 ETF Units Thailand Depository Receipt Repr 1 Sh,SET,Miscellaneous,Investment Trusts/Mutual Funds,34.75,35.25,34.25,35.25,3.6764705882352944,,749990,THB
STARM,Star Money Public Company Limited,SET,Distribution Services,Wholesale Distributors,0.92,0.93,0.91,0.93,1.0869565217391313,1023000000.0,234500,THB
STARM.R,Star Money Public Company Limited NVDR,SET,Distribution Services,Wholesale Distributors,0.92,0.93,0.91,0.93,1.0869565217391313,1023000000.0,234500,THB
STC,STC Concrete Product PCL,SET,Non-Energy Minerals,Construction Materials,0.41,0.41,0.4,0.4,-2.4390243902438913,227200003.0,216500,THB
STC.R,STC Concrete Product PCL NVDR,SET,Non-Energy Minerals,Construction Materials,0.41,0.41,0.4,0.4,-2.4390243902438913,227200003.0,216500,THB
STECH,"Siam Technic Concrete Public Co., Ltd.",SET,Non-Energy Minerals,Construction Materials,1.01,1.02,1.01,1.01,-0.980392156862746,732249993.0,506000,THB
STECH.R,"Siam Technic Concrete Public Co., Ltd. NVDR",SET,Non-Energy Minerals,Construction Materials,1.01,1.02,1.01,1.01,-0.980392156862746,732249993.0,506000,THB
STECON,Stecon Group Public Company Limited,SET,Industrial Services,Engineering & Construction,8.05,9.25,7.9,8.8,13.548387096774203,13244538560.0,137523435,THB
STECON.R,Stecon Group Public Company Limited NVDR,SET,Industrial Services,Engineering & Construction,8.05,9.25,7.9,8.8,13.548387096774203,13244538560.0,137518800,THB
STEG19,Singapore Technologies Engineering Ltd Units Thailand Depository Receipt Repr 0.1 Sh,SET,Electronic Technology,Aerospace & Defense,20.0,20.0,19.8,19.8,-1.4925373134328392,618729901710.9414,10892,THB
STELLA,Stella X Public Company Limited,SET,Finance,Real Estate Development,0.2,0.21,0.19,0.21,4.99999999999999,3088512970.0,5671400,THB
STELLA.R,Stella X Public Company Limited NVDR,SET,Finance,Real Estate Development,0.2,0.21,0.19,0.21,4.99999999999999,3088512970.0,5671400,THB
STGT,Sri Trang Gloves (Thailand) Public Co. Ltd.,SET,Producer Manufacturing,Miscellaneous Manufacturing,6.2,6.5,6.2,6.45,4.032258064516129,18480410013.0,4915763,THB
STGT.R,Sri Trang Gloves (Thailand) Public Co. Ltd. NVDR,SET,Producer Manufacturing,Miscellaneous Manufacturing,6.2,6.5,6.2,6.45,4.032258064516129,18480410013.0,4915400,THB
STI,"Stonehenge Inter Public Co., Ltd.",SET,Commercial Services,Miscellaneous Commercial Services,2.0,2.02,1.99,2.02,-0.980392156862746,1218054071.0,22200,THB
STI.R,"Stonehenge Inter Public Co., Ltd. NVDR",SET,Commercial Services,Miscellaneous Commercial Services,2.0,2.02,1.99,2.02,-0.980392156862746,1218054071.0,22200,THB
STOWER,Sky Tower Public Co Limited,SET,Industrial Services,Engineering & Construction,0.05,0.05,0.04,0.05,0.0,184868765.0,10567,THB
STOWER.R,Sky Tower Public Co Limited NVDR,SET,Industrial Services,Engineering & Construction,0.05,0.05,0.04,0.05,0.0,184868765.0,10500,THB
STP,Sahathai Printing & Packaging PCL,SET,Commercial Services,Commercial Printing/Forms,11.1,11.3,11.1,11.3,0.0,1130000000.0,14401,THB
STP.R,Sahathai Printing & Packaging PCL NVDR,SET,Commercial Services,Commercial Printing/Forms,11.1,11.3,11.1,11.3,0.0,1130000000.0,14400,THB
STPI,STP&I Public Co. Ltd.,SET,Producer Manufacturing,Metal Fabrication,4.06,4.26,4.02,4.08,2.0000000000000018,7287253399.0,54846697,THB
STPI.R,STP&I Public Co. Ltd. NVDR,SET,Producer Manufacturing,Metal Fabrication,4.06,4.26,4.02,4.08,2.0000000000000018,7287253399.0,54846100,THB
STX,Stone One Public Company Limited,SET,Non-Energy Minerals,Construction Materials,1.31,1.32,1.28,1.29,-0.7692307692307698,396203634.0,801701,THB
STX.R,Stone one Public Company Limited NVDR,SET,Non-Energy Minerals,Construction Materials,1.31,1.32,1.28,1.29,-0.7692307692307698,396203634.0,801700,THB
SUC,Saha-Union Public Co. Ltd.,SET,Consumer Durables,Home Furnishings,29.5,29.5,29.25,29.5,0.0,8850000000.0,69004,THB
SUC.R,Saha-Union Public Co. Ltd. NVDR,SET,Consumer Durables,Home Furnishings,29.5,29.5,29.25,29.5,0.0,8850000000.0,69000,THB
SUN,Sunsweet Public Company Ltd,SET,Consumer Non-Durables,Food: Specialty/Candy,3.32,3.44,3.3,3.3,0.0,2554188684.0,1500053,THB
SUN.R,Sunsweet Public Company Ltd NVDR,SET,Consumer Non-Durables,Food: Specialty/Candy,3.32,3.44,3.3,3.3,0.0,2554188684.0,1500000,THB
SUNNY19,"Sunny Optical Technology (Group) Co., Ltd. Units Thailand Depositery Receipts Repr 0.01 Sh",SET,Electronic Technology,Electronic Components,3.28,3.32,3.26,3.32,2.469135802469124,361359928190.99,139486,THB
SUPER,Super Energy Corporation Public Company Limited,SET,Utilities,Electric Utilities,0.15,0.16,0.14,0.15,7.142857142857128,4102420183.0,57351063,THB
SUPER.R,Super Energy Corporation Public Company Limited NVDR,SET,Utilities,Electric Utilities,0.15,0.16,0.14,0.15,7.142857142857128,4102420183.0,57350900,THB
SUPEREIF,Super Energy Power Plant Infrastructure Fund,SET,Finance,Financial Conglomerates,5.35,5.35,5.3,5.3,0.0,2729500098.0,62801,THB
SUSCO,Susco Public Company Limited,SET,Retail Trade,Specialty Stores,2.58,2.6,2.56,2.56,0.0,2559999787.0,667825,THB
SUSCO.R,Susco Public Company Limited NVDR,SET,Retail Trade,Specialty Stores,2.58,2.6,2.56,2.56,0.0,2559999787.0,667500,THB
SUTHA,Golden Lime Public Company Ltd,SET,Non-Energy Minerals,Construction Materials,2.5,2.54,2.5,2.54,1.6000000000000014,920478375.0,12300,THB
SUTHA.R,Golden Lime Public Company Ltd NVDR,SET,Non-Energy Minerals,Construction Materials,2.5,2.54,2.5,2.54,1.6000000000000014,920478375.0,12300,THB
SVI,"SVI Public Co., Ltd.",SET,Electronic Technology,Electronic Components,5.85,5.9,5.8,5.85,0.0,12494457218.0,245408,THB
SVI.R,"SVI Public Co., Ltd. NVDR",SET,Electronic Technology,Electronic Components,5.85,5.9,5.8,5.85,0.0,12494457218.0,245400,THB
SVOA,"SVOA Public Co., Ltd.",SET,Distribution Services,Electronics Distributors,1.53,1.59,1.49,1.49,-1.9736842105263175,1053430006.9999999,5781410,THB
SVOA.R,"SVOA Public Co., Ltd. NVDR",SET,Distribution Services,Electronics Distributors,1.53,1.59,1.49,1.49,-1.9736842105263175,1053430006.9999999,5781400,THB
SVR,Sivarom Real Estate Public Company Limited,SET,Finance,Real Estate Development,0.52,0.53,0.52,0.53,1.9230769230769247,270300000.0,48500,THB
SVR.R,Sivarom Real Estate Public Company Limited NVDR,SET,Finance,Real Estate Development,0.52,0.53,0.52,0.53,1.9230769230769247,270300000.0,48500,THB
SVT,Sun Vending Technology Public Company Limited,SET,Consumer Non-Durables,Beverages: Non-Alcoholic,1.35,1.4,1.35,1.37,1.4814814814814827,959000003.0,1990100,THB
SVT.R,Sun Vending Technology Public Company Limited NVDR,SET,Consumer Non-Durables,Beverages: Non-Alcoholic,1.35,1.4,1.35,1.37,1.4814814814814827,959000003.0,1990100,THB
SWC,Sherwood Corp. (Thailand) Public Co. Ltd.,SET,Process Industries,Chemicals: Agricultural,3.86,4.0,3.86,3.96,1.020408163265307,1974979443.0,216617,THB
SWC.R,Sherwood Corp. (Thailand) Public Co. Ltd. NVDR,SET,Process Industries,Chemicals: Agricultural,3.86,4.0,3.86,3.96,1.020408163265307,1974979443.0,216600,THB
SYMC,"Symphony Communication Public Co., Ltd.",SET,Communications,Specialty Telecommunications,4.18,4.22,4.18,4.2,0.0,1821350399.0,109612,THB
SYMC.R,"Symphony Communication Public Co., Ltd. NVDR",SET,Communications,Specialty Telecommunications,4.18,4.22,4.18,4.2,0.0,1821350399.0,109600,THB
SYNEX,"Synnex (Thailand) Public Co., Ltd.",SET,Distribution Services,Electronics Distributors,12.5,12.7,12.5,12.6,1.6129032258064457,10676751520.0,1424526,THB
SYNEX.R,"Synnex (Thailand) Public Co., Ltd. NVDR",SET,Distribution Services,Electronics Distributors,12.5,12.7,12.5,12.6,1.6129032258064457,10676751520.0,1424400,THB
SYNTEC,Syntec Construction Public Co. Ltd.,SET,Industrial Services,Engineering & Construction,1.85,1.88,1.85,1.88,1.0752688172042901,2974004397.0,433700,THB
SYNTEC.R,Syntec Construction Public Co. Ltd. NVDR,SET,Industrial Services,Engineering & Construction,1.85,1.88,1.85,1.88,1.0752688172042901,2974004397.0,433700,THB
TACC,T.A.C. Consumer Public Co. Ltd.,SET,Consumer Non-Durables,Food: Specialty/Candy,4.96,4.96,4.86,4.88,-0.8130081300813016,2967040070.0,1080403,THB
TACC.R,T.A.C. Consumer Public Co. Ltd. NVDR,SET,Consumer Non-Durables,Food: Specialty/Candy,4.96,4.96,4.86,4.88,-0.8130081300813016,2967040070.0,1080100,THB
TAE,"Thai Agro Energy Public Co., Ltd.",SET,Process Industries,Chemicals: Specialty,0.59,0.59,0.56,0.58,-1.6949152542372898,579999983.0,220400,THB
TAE.R,"Thai Agro Energy Public Co., Ltd. NVDR",SET,Process Industries,Chemicals: Specialty,0.59,0.59,0.56,0.58,-1.6949152542372898,579999983.0,220400,THB
TAIWAN19,Yuanta/P-shares Taiwan Top 50 ETF Units Thailand Depository Receipt Repr 0.01 Sh,SET,Miscellaneous,Investment Trusts/Mutual Funds,22.8,22.8,22.7,22.8,1.3333333333333366,,2290,THB
TAIWANAI13,KGI Taiwan Premium Selection AI 50 ETF Units Thailand Depositery Receipts Repr 0.01 Sh,SET,Miscellaneous,Investment Trusts/Mutual Funds,11.4,11.5,11.4,11.5,1.7699115044247724,,21078,THB
TAIWANHD13,KGI Taiwan Premium Selection High Dividend 30 ETF Units Thailand Depositery Receipts Repr 0.01 Sh,SET,Miscellaneous,Investment Trusts/Mutual Funds,24.5,24.5,24.3,24.4,-0.40816326530612823,,1075,THB
TAKUNI,Takuni Group Public Company Ltd,SET,Utilities,Gas Distributors,0.49,0.5,0.48,0.48,-2.040816326530614,383999991.0,5710501,THB
TAKUNI.R,Takuni Group Public Company Ltd NVDR,SET,Utilities,Gas Distributors,0.49,0.5,0.48,0.48,-2.040816326530614,383999991.0,5710400,THB
