symbol,description,exchange,sector,industry,open,high,low,Close,Change%,MarketCap,Volume,Currency
F&D,Food & Drinks Public Co. Ltd.,SET,Consumer Non-Durables,Food: Major Diversified,57.0,57.0,57.0,57.0,0.0,1004585644.0,509,THB
F&D.R,Food & Drinks Public Co. Ltd. NVDR,SET,Consumer Non-Durables,Food: Major Diversified,57.0,57.0,57.0,57.0,0.0,1004585644.0,500,THB
FANCY,"Fancy Wood Industries Public Co., Ltd.",SET,Consumer Durables,Home Furnishings,0.4,0.4,0.39,0.4,2.5641025641025665,246000004.0,72117,THB
FANCY.R,"Fancy Wood Industries Public Co., Ltd. NVDR",SET,Consumer Durables,Home Furnishings,0.4,0.4,0.39,0.4,2.5641025641025665,246000004.0,72100,THB
FE,"Far East Fame Line DDB Public Co., Ltd.",SET,Commercial Services,Advertising/Marketing Services,189.0,190.0,189.0,190.0,1.0638297872340425,1495299978.0,1600,THB
FE.R,"Far East Fame Line DDB Public Co., Ltd. NVDR",SET,Commercial Services,Advertising/Marketing Services,189.0,190.0,189.0,190.0,1.0638297872340425,1495299978.0,1600,THB
FERRARI80,Ferrari NV Units Thailand Depository Receipt Repr 0.0001 Sh,SET,Consumer Durables,Motor Vehicles,1.59,1.6,1.56,1.58,-1.250000000000001,3727654470257.962,92004,THB
FLOYD,Floyd Public Co. Ltd.,SET,Industrial Services,Engineering & Construction,0.95,0.98,0.94,0.97,2.105263157894739,431109598.0,620572,THB
FLOYD.R,Floyd Public Company Ltd NVDR,SET,Industrial Services,Engineering & Construction,0.95,0.98,0.94,0.97,2.105263157894739,431109598.0,620500,THB
FM,Food Moments Public Company Limited,SET,Process Industries,Agricultural Commodities/Milling,3.88,3.9,3.86,3.88,0.5181347150259072,3832771864.0,485268,THB
FM.R,Food Moments Public Company Limited NVDR,SET,Process Industries,Agricultural Commodities/Milling,3.88,3.9,3.86,3.88,0.5181347150259072,3832771864.0,485200,THB
FMT,Fine Metal Technologies Public Co. Ltd.,SET,Producer Manufacturing,Metal Fabrication,25.5,25.5,25.5,25.5,-2.857142857142857,1224000000.0,307,THB
FMT.R,Fine Metal Technologies Public Co. Ltd. NVDR,SET,Producer Manufacturing,Metal Fabrication,25.5,25.5,25.5,25.5,-2.857142857142857,1224000000.0,300,THB
FN,FN Factory Outlet Public Co. Ltd.,SET,Retail Trade,Discount Stores,0.53,0.54,0.52,0.52,0.0,519999981.00000006,155100,THB
FN.R,FN Factory Outlet Public Company Ltd NVDR,SET,Retail Trade,Discount Stores,0.53,0.54,0.52,0.52,0.0,519999981.00000006,155100,THB
FNS,FNS Holdings Public Company Limited,SET,Finance,Investment Banks/Brokers,0.89,0.89,0.87,0.89,2.2988505747126458,307811335.0,58900,THB
FNS.R,FNS Holdings Public Company Limited NVDR,SET,Finance,Investment Banks/Brokers,0.89,0.89,0.87,0.89,2.2988505747126458,307811335.0,58900,THB
FORTH,Forth Corp. Public Co. Ltd.,SET,Electronic Technology,Electronic Equipment/Instruments,7.3,7.7,7.25,7.6,6.2937062937062835,7108847591.0,1591799,THB
FORTH.R,Forth Corp. Public Co. Ltd. NVDR,SET,Electronic Technology,Electronic Equipment/Instruments,7.3,7.7,7.25,7.6,6.2937062937062835,7108847591.0,1591600,THB
FPI,Fortune Parts Industry Plc,SET,Producer Manufacturing,Auto Parts: OEM,1.6,1.6,1.55,1.55,-2.5157232704402537,2283196286.0,484400,THB
FPI.R,Fortune Parts Industry Plc NVDR,SET,Producer Manufacturing,Auto Parts: OEM,1.6,1.6,1.55,1.55,-2.5157232704402537,2283196286.0,484400,THB
FPT,Frasers Property Thailand Public Co. Ltd.,SET,Finance,Real Estate Development,6.2,6.3,6.15,6.3,1.6129032258064457,14611449246.0,74010,THB
FPT.R,Frasers Property Thailand Public Co. Ltd. NVDR,SET,Finance,Real Estate Development,6.2,6.3,6.15,6.3,1.6129032258064457,14611449246.0,74000,THB
FPTVN19,FPT Corp. Units Thailand Depositery Receipts Repr 0.01 Sh,SET,Technology Services,Information Technology Services,13.0,13.0,12.8,12.8,-1.538461538461533,215883209311.054,348453,THB
FSMART,Forth Smart Service Public Company Limited,SET,Commercial Services,Miscellaneous Commercial Services,6.8,7.15,6.7,6.95,5.303030303030312,4908664309.0,8230480,THB
FSMART.R,Forth Smart Service Public Company Limited NVDR,SET,Commercial Services,Miscellaneous Commercial Services,6.8,7.15,6.7,6.95,5.303030303030312,4908664309.0,8230300,THB
FSX,Finansia X Public Company Limited,SET,Finance,Financial Conglomerates,1.16,1.19,1.09,1.17,-1.6806722689075646,958074109.1999999,59000,THB
FSX.R,Finansia X Public Company Limited NVDR,SET,Finance,Financial Conglomerates,1.16,1.19,1.09,1.17,-1.6806722689075646,958074109.1999999,59000,THB
FTE,Firetrade Engineering Public Company Ltd,SET,Producer Manufacturing,Industrial Conglomerates,1.69,1.7,1.68,1.7,0.5917159763313614,1121999928.0,25005,THB
FTE.R,Firetrade Engineering Public Company Ltd NVDR,SET,Producer Manufacturing,Industrial Conglomerates,1.69,1.7,1.68,1.7,0.5917159763313614,1121999928.0,25000,THB
FTI,Function International Public Company Limited,SET,Distribution Services,Wholesale Distributors,1.96,1.96,1.95,1.95,0.0,877500000.0,2100,THB
FTI.R,Function International Public Company Limited NVDR,SET,Distribution Services,Wholesale Distributors,1.96,1.96,1.95,1.95,0.0,877500000.0,2100,THB
FTREIT,Frasers Property Thailand Industrial Freehold & Leasehold REIT,SET,Finance,Real Estate Investment Trusts,9.1,9.2,9.1,9.2,0.5464480874316823,30265744294.0,1109314,THB
FUEVFVND01,DCVFMVN DIAMOND ETF Units Depository Receipt Interests Repr 1 Unit,SET,Miscellaneous,Investment Trusts/Mutual Funds,49.25,49.5,48.0,48.25,-1.0256410256410255,,764447,THB
FVC,Filter Vision Public Company Ltd,SET,Producer Manufacturing,Industrial Machinery,0.5,0.53,0.5,0.5,0.0,282571472.0,5773290,THB
FVC.R,Filter Vision Public Company Ltd NVDR,SET,Producer Manufacturing,Industrial Machinery,0.5,0.53,0.5,0.5,0.0,282571472.0,5773200,THB
GABLE,G-Able Public Company Limited,SET,Technology Services,Information Technology Services,3.0,3.04,3.0,3.02,1.342281879194632,2114064628.0,97449,THB
GABLE.R,G-Able Public Company Limited NVDR,SET,Technology Services,Information Technology Services,3.0,3.04,3.0,3.02,1.342281879194632,2114064628.0,97400,THB
GAHREIT,Grande Hospitality Real Estate Investment Trust,SET,Finance,Real Estate Investment Trusts,5.1,5.15,4.98,5.1,-0.9708737864077808,895049983.0,210401,THB
GBX,Globlex Holding Management Public Co. Ltd.,SET,Finance,Investment Banks/Brokers,0.46,0.47,0.46,0.47,2.1739130434782505,511865914.0,26900,THB
GBX.R,Globlex Holding Management Public Co. Ltd. NVDR,SET,Finance,Investment Banks/Brokers,0.46,0.47,0.46,0.47,2.1739130434782505,511865914.0,26900,THB
GC,Global Connections Public Company Limited,SET,Producer Manufacturing,Industrial Conglomerates,4.04,4.04,4.0,4.04,0.0,1777599983.0,163526,THB
GC.R,Global Connections Public Company Limited,SET,Producer Manufacturing,Industrial Conglomerates,4.04,4.04,4.0,4.04,0.0,1777599983.0,163500,THB
GCAP,G Capital Public Co. Ltd.,SET,Finance,Finance/Rental/Leasing,0.45,0.47,0.44,0.44,2.325581395348839,238434828.0,3543101,THB
GCAP.R,G Capital Public Co. Ltd. NVDR,SET,Finance,Finance/Rental/Leasing,0.45,0.47,0.44,0.44,2.325581395348839,238434828.0,3543100,THB
GEL,"General Engineering Public Co., Ltd.",SET,Non-Energy Minerals,Construction Materials,0.04,0.04,0.03,0.04,0.0,344481945.0,278108,THB
GEL.R,"General Engineering Public Co., Ltd. NVDR",SET,Non-Energy Minerals,Construction Materials,0.04,0.04,0.03,0.04,0.0,344481945.0,278100,THB
GENCO,General Environmental Conservation Public Co. Ltd.,SET,Industrial Services,Environmental Services,0.26,0.28,0.26,0.27,-3.571428571428574,303020366.0,320880,THB
GENCO.R,General Environmental Conservation Public Co. Ltd. NVDR,SET,Industrial Services,Environmental Services,0.26,0.28,0.26,0.27,-3.571428571428574,303020366.0,320800,THB
GFC,Genesis Fertility Center Public Company Limited,SET,Health Services,Medical/Nursing Services,3.72,3.72,3.64,3.64,-0.5464480874316944,800800000.0,65402,THB
GFC.R,Genesis Fertility Center Public Company Limited NVDR,SET,Health Services,Medical/Nursing Services,3.72,3.72,3.64,3.64,-0.5464480874316944,800800000.0,65400,THB
GFPT,GFPT Public Co. Ltd.,SET,Consumer Non-Durables,Food: Meat/Fish/Dairy,9.55,9.7,9.5,9.6,0.5235602094240727,12036682510.0,1764183,THB
GFPT.R,GFPT Public Co. Ltd. NVDR,SET,Consumer Non-Durables,Food: Meat/Fish/Dairy,9.55,9.7,9.5,9.6,0.5235602094240727,12036682510.0,1764100,THB
GGC,Global Green Chemicals Public Co. Ltd.,SET,Process Industries,Chemicals: Specialty,3.84,3.9,3.84,3.9,1.0362694300518145,3992300177.0,32300,THB
GGC.R,Global Green Chemicals Public Co. Ltd. NVDR,SET,Process Industries,Chemicals: Specialty,3.84,3.9,3.84,3.9,1.0362694300518145,3992300177.0,32300,THB
GJS,"GJ Steel Public Co., Ltd.",SET,Non-Energy Minerals,Steel,0.14,0.15,0.14,0.14,-6.666666666666654,3568198882.0,179600,THB
GJS.R,"GJ Steel Public Co., Ltd. NVDR",SET,Non-Energy Minerals,Steel,0.14,0.15,0.14,0.14,-6.666666666666654,3568198882.0,179600,THB
GLD,KTAM Gold ETF Tracker,SET,Miscellaneous,Investment Trusts/Mutual Funds,4.55,4.56,4.54,4.56,0.21978021978021509,,727901,THB
GLOBAL,"Siam Global House Public Co., Ltd.",SET,Retail Trade,Home Improvement Chains,7.85,8.15,7.75,7.9,1.9354838709677464,42675210330.0,22234400,THB
GLOBAL.R,"Siam Global House Public Co., Ltd. NVDR",SET,Retail Trade,Home Improvement Chains,7.85,8.15,7.75,7.9,1.9354838709677464,42675210330.0,22233300,THB
GLORY,Glory Forever Public Company Limited,SET,Technology Services,Internet Software/Services,1.02,1.08,1.02,1.08,4.854368932038839,291600012.0,8300,THB
GLORY.R,Glory Forever Public Company Limited NVDR,SET,Technology Services,Internet Software/Services,1.02,1.08,1.02,1.08,4.854368932038839,291600012.0,8300,THB
GOLD03,SPDR Gold Trust Units Thailand Depositary Receipts Repr 0.01 Sh,SET,Miscellaneous,Investment Trusts/Mutual Funds,2.64,2.68,2.64,2.66,0.0,,91531,THB
GOLD19,SPDR Gold Trust Units Thailand Depository Receipt Repr 0.001 Sh,SET,Finance,Investment Banks/Brokers,10.6,10.7,10.5,10.6,0.0,,206945,THB
GOLDUS19,SPDR Gold Trust Units Thailand Depositery Receipts Repr 0.01 Sh,SET,Finance,Investment Banks/Brokers,35.25,35.75,35.25,35.5,1.4285714285714286,,11307,THB
GOOG80,Alphabet Inc. Units Thailand Depository Receipt Repr 0.0005 Sh,SET,Technology Services,Internet Software/Services,3.76,3.8,3.72,3.78,0.5319148936170218,91977130056842.45,2193001,THB
GOOGL01,Alphabet Inc. Units Thailand Depositery Receipts Repr 0.01 Sh,SET,Technology Services,Internet Software/Services,22.0,22.1,21.9,22.0,0.0,91977130056842.45,14637,THB
GPI,Grand Prix International Co. Ltd.,SET,Commercial Services,Miscellaneous Commercial Services,1.61,1.63,1.6,1.6,-0.6211180124223608,960000014.0,274115,THB
GPI.R,Grand Prix International Public Company Ltd NVDR,SET,Commercial Services,Miscellaneous Commercial Services,1.61,1.63,1.6,1.6,-0.6211180124223608,960000014.0,274100,THB
GPSC,Global Power Synergy Public Company Ltd,SET,Utilities,Electric Utilities,41.0,41.75,40.75,41.25,2.484472049689441,116313841553.0,9453995,THB
GPSC.R,Global Power Synergy Public Company Ltd NVDR,SET,Utilities,Electric Utilities,41.0,41.75,40.75,41.25,2.484472049689441,116313841553.0,9453300,THB
GRAMMY,GMM Grammy Public Co. Ltd.,SET,Consumer Services,Movies/Entertainment,4.6,4.6,4.54,4.6,0.0,3771768855.0,1117,THB
GRAMMY.R,GMM Grammy Public Co. Ltd. NVDR,SET,Consumer Services,Movies/Entertainment,4.6,4.6,4.54,4.6,0.0,3771768855.0,1100,THB
GRAND,Grande Asset Hotels & Property Public Co. Ltd.,SET,Consumer Services,Hotels/Resorts/Cruise lines,0.05,0.05,0.04,0.04,-20.000000000000004,371422570.0,172000,THB
GRAND.R,Grande Asset Hotels & Property Public Co. Ltd. NVDR,SET,Consumer Services,Hotels/Resorts/Cruise lines,0.05,0.05,0.04,0.04,-20.000000000000004,371422570.0,172000,THB
GREEN,Green Resources Public Company Limited,SET,Utilities,Electric Utilities,0.7,0.7,0.68,0.69,-1.42857142857143,564437012.0,2205960,THB
GREEN.R,Green Resources Public Company Limited NVDR,SET,Utilities,Electric Utilities,0.7,0.7,0.68,0.69,-1.42857142857143,564437012.0,2205900,THB
GROREIT,Grande Royal Orchid Hospitality Real Estate Investment Trust with Buy-Back Condition,SET,Finance,Real Estate Investment Trusts,7.9,8.0,7.9,8.0,1.265822784810122,2520000000.0,47801,THB
GTB,Getabec Public Company Ltd,SET,Producer Manufacturing,Industrial Machinery,0.71,0.71,0.7,0.71,0.0,681599979.0,3500,THB
GTB.R,Getabec Public Company Ltd NVDR,SET,Producer Manufacturing,Industrial Machinery,0.71,0.71,0.7,0.71,0.0,681599979.0,3500,THB
GTV,Green Tech Ventures Public Company Limited,SET,Utilities,Alternative Power Generation,0.08,0.09,0.07,0.09,12.499999999999993,1181730897.0,1190500,THB
GTV.R,Green Tech Ventures Public Company Limited NVDR,SET,Utilities,Alternative Power Generation,0.08,0.09,0.07,0.09,12.499999999999993,1181730897.0,1190500,THB
GULF,Gulf Development Public Company Limited,SET,Industrial Services,Engineering & Construction,47.5,48.25,47.0,47.5,1.0638297872340425,709642299805.0,105771422,THB
GULF.R,Gulf Development Public Company Limited NVDR,SET,Industrial Services,Engineering & Construction,47.5,48.25,47.0,47.5,1.0638297872340425,709642299805.0,105767000,THB
GUNKUL,Gunkul Engineering Public Co. Ltd.,SET,Utilities,Alternative Power Generation,1.93,1.99,1.93,1.96,2.0833333333333353,17409761589.0,62981828,THB
GUNKUL.R,Gunkul Engineering Public Co. Ltd. NVDR,SET,Utilities,Alternative Power Generation,1.93,1.99,1.93,1.96,2.0833333333333353,17409761589.0,62980700,THB
GVREIT,Golden Ventures Leasehold REIT,SET,Finance,Real Estate Investment Trusts,6.25,6.3,6.25,6.3,0.7999999999999973,5133240079.0,439091,THB
GYT,"Goodyear (Thailand) Public Co., Ltd.",SET,Consumer Durables,Automotive Aftermarket,193.0,193.0,193.0,193.0,0.5208333333333333,1428200018.0,100,THB
GYT.R,"Goodyear (Thailand) Public Co., Ltd. NVDR",SET,Consumer Durables,Automotive Aftermarket,193.0,193.0,193.0,193.0,0.5208333333333333,1428200018.0,100,THB
HAIERS19,"Haier Smart Home Co., Ltd. Units Thailand Depositery Receipts Repr 0.01 Sh",SET,Consumer Durables,Electronics/Appliances,10.5,10.7,10.5,10.6,0.952380952380949,1074422791703.8368,48996,THB
HANA,"Hana Microelectronics Public Co., Ltd.",SET,Electronic Technology,Semiconductors,24.7,25.25,24.7,25.25,2.6422764227642217,20323190842.0,11322794,THB
HANA.R,"Hana Microelectronics Public Co., Ltd. NVDR",SET,Electronic Technology,Semiconductors,24.7,25.25,24.7,25.25,2.6422764227642217,20323190842.0,11321800,THB
HANN,Mukdahan International Hospital Public Company Limited,SET,Health Services,Hospital/Nursing Management,1.49,1.55,1.49,1.5,0.671140939597316,840000000.0,24629969,THB
HANN.R,Mukdahan International Hospital Public Company Limited NVDR,SET,Health Services,Hospital/Nursing Management,1.49,1.55,1.49,1.5,0.671140939597316,,24629200,THB
HARN,Harn Engineering Solutions Public Co. Ltd.,SET,Distribution Services,Wholesale Distributors,1.99,1.99,1.97,1.99,0.0,1163154884.0,42900,THB
HARN.R,Harn Engineering Solutions Public Co. Ltd. NVDR,SET,Distribution Services,Wholesale Distributors,1.99,1.99,1.97,1.99,0.0,1163154884.0,42900,THB
HEALTH,Health Empire Corporation Public Company Limited,SET,Consumer Services,Movies/Entertainment,0.3,0.42,0.3,0.42,31.249999999999993,177525822.0,2059110,THB
HEALTH.R,Health Empire Corporation Public Company Limited NVDR,SET,Consumer Services,Movies/Entertainment,0.3,0.42,0.3,0.42,31.249999999999993,177525822.0,2059100,THB
HENG,Heng Leasing and Capital Public Company Limited,SET,Finance,Finance/Rental/Leasing,1.11,1.18,1.1,1.16,5.454545454545439,4419599873.0,27316721,THB
HENG.R,Heng Leasing and Capital Public Company Limited NVDR,SET,Finance,Finance/Rental/Leasing,1.11,1.18,1.1,1.16,5.454545454545439,4419599873.0,27316600,THB
HERMES80,Hermes International SCA Units Thailand Depository Receipt Repr 0.0001 Sh,SET,Consumer Non-Durables,Apparel/Footwear,7.65,7.7,7.65,7.7,0.6535947712418277,8040488127088.14,13394,THB
HFT,Hwa Fong Rubber (Thailand) Public Co. Ltd.,SET,Consumer Durables,Automotive Aftermarket,4.16,4.22,4.16,4.22,0.956937799043063,2778592718.0,28010,THB
HFT.R,Hwa Fong Rubber (Thailand) Public Co. Ltd. NVDR,SET,Consumer Durables,Automotive Aftermarket,4.16,4.22,4.16,4.22,0.956937799043063,2778592718.0,28000,THB
HK01,Tracker Fund of Hong Kong Units Thailand Depository Receipt Repr 0.01 Sh,SET,Finance,Investment Banks/Brokers,21.3,21.5,21.2,21.4,0.943396226415091,,22886,THB
HK13,Tracker Fund of Hong Kong Units Thailand Depository Receipt REPR 0.05,SET,Miscellaneous,Investment Trusts/Mutual Funds,5.3,5.35,5.25,5.35,0.943396226415091,,19403,THB
HKCE01,Hang Seng China Enterprises Index ETF Units Thailand Depository Receipt Repr 0.066666667 Sh,SET,Finance,Investment Banks/Brokers,25.5,25.75,25.25,25.75,0.9803921568627451,,30274,THB
HKEX23,Hong Kong Exchanges & Clearing Ltd. Units Thailand Depositery Receipts Repr 0.01 Sh,SET,Finance,Investment Banks/Brokers,2.32,2.36,2.32,2.34,0.0,2285135660854.3135,482311,THB
HKTECH13,Hang Seng Investment Management Ltd Units Thailand Depository Receipt Repr 0.2,SET,Finance,Investment Managers,4.54,4.66,4.54,4.62,1.3157894736842215,,137049,THB
HL,Healthlead Public Company Limited,SET,Finance,Financial Conglomerates,7.3,7.35,7.3,7.3,0.0,1985600052.0,20100,THB
HL.R,Healthlead Public Company Limited NVDR,SET,Finance,Financial Conglomerates,7.3,7.35,7.3,7.3,0.0,1985600052.0,20100,THB
HMPRO,"Home Product Center Public Co., Ltd.",SET,Retail Trade,Home Improvement Chains,7.7,7.85,7.65,7.7,0.6535947712418277,101264223956.0,32428215,THB
HMPRO.R,"Home Product Center Public Co., Ltd. NVDR",SET,Retail Trade,Home Improvement Chains,7.7,7.85,7.65,7.7,0.6535947712418277,101264223956.0,32427200,THB
HONDA19,"Honda Motor Co., Ltd. Units Thailand Depository Receipt Repr 0.01 Sh",SET,Consumer Durables,Motor Vehicles,3.66,3.7,3.66,3.68,0.5464480874316944,1778835091281.4363,25389,THB
HPF,Hemaraj Industrial Property & Leasehold Fund,SET,Miscellaneous,Investment Trusts/Mutual Funds,4.86,4.9,4.86,4.9,0.8230452674897125,2303000000.0,42400,THB
HPG19,Hoa Phat Group JSC Units Thailand Depositery Receipts Repr 0.01 Sh,SET,Non-Energy Minerals,Steel,3.7,3.74,3.58,3.64,-1.621621621621623,271757676924.94333,1254547,THB
HPT,Home Pottery Public Co. Ltd.,SET,Consumer Durables,Home Furnishings,0.36,0.37,0.35,0.36,0.0,238348552.0,2452732,THB
HPT.R,Home Pottery Public Company Ltd NVDR,SET,Consumer Durables,Home Furnishings,0.36,0.37,0.35,0.36,0.0,238348552.0,2452700,THB
HSHD23,Global X Hang Seng High Dividend Yield ETF Units Thailand Depositery Receipts Repr 0.01 Sh,SET,Miscellaneous,Investment Trusts/Mutual Funds,6.2,6.25,6.15,6.25,2.459016393442629,,77753,THB
HTC,Haad Thip Public Co. Ltd.,SET,Consumer Non-Durables,Beverages: Non-Alcoholic,15.3,15.3,15.2,15.3,0.0,6149391224.0,588953,THB
HTC.R,Haad Thip Public Co. Ltd. NVDR,SET,Consumer Non-Durables,Beverages: Non-Alcoholic,15.3,15.3,15.2,15.3,0.0,6149391224.0,588500,THB
HTECH,Halcyon Technology PCL,SET,Producer Manufacturing,Industrial Machinery,2.7,2.72,2.64,2.66,-1.4814814814814827,798000919.0,593721,THB
HTECH.R,Halcyon Technology PCL NVDR,SET,Producer Manufacturing,Industrial Machinery,2.7,2.72,2.64,2.66,-1.4814814814814827,798000919.0,593700,THB
HUAHONG23,Hua Hong Semiconductor Ltd. Units Thailand Depositery Receipts Repr 0.01 Sh,SET,Electronic Technology,Semiconductors,2.76,2.86,2.74,2.82,3.676470588235281,392624169278.94403,1988780,THB
HUMAN,Humanica Public Co. Ltd.,SET,Commercial Services,Miscellaneous Commercial Services,7.45,7.5,7.25,7.3,0.0,6332338026.0,556501,THB
HUMAN.R,Humanica Public Co. Ltd. NVDR,SET,Commercial Services,Miscellaneous Commercial Services,7.45,7.5,7.25,7.3,0.0,6332338026.0,556500,THB
HYDRO,"Hydrotek Public Co,. Ltd.",SET,Industrial Services,Engineering & Construction,5.0,5.0,4.96,4.98,-1.3861386138613743,1463252062.0,20021,THB
HYDRO.R,"Hydrotek Public Co,. Ltd. NVDR",SET,Industrial Services,Engineering & Construction,5.0,5.0,4.96,4.98,-1.3861386138613743,1463252062.0,20000,THB
HYDROGEN,Hydrogen Freehold & Leasehold Real Estate Investment Trust,SET,Finance,Real Estate Investment Trusts,8.65,8.8,8.65,8.7,0.0,1807164000.0,22600,THB
I2,I2 Enterprise Public Company Limited,SET,Technology Services,Information Technology Services,0.82,0.85,0.82,0.83,1.2195121951219523,348600000.0,1224103,THB
I2.R,I2 Enterprise Public Company Limited NVDR,SET,Technology Services,Information Technology Services,0.82,0.85,0.82,0.83,1.2195121951219523,348600000.0,1224100,THB
ICBC19,Industrial and Commercial Bank of China Limited Units Thailand Depositery Receipts Repr 0.01 Sh,SET,Finance,Major Banks,2.38,2.4,2.36,2.4,0.0,11159028283341.158,98326,THB
ICC,"I.C.C. International Public Co., Ltd.",SET,Distribution Services,Wholesale Distributors,25.0,25.25,25.0,25.25,3.061224489795918,12625000000.0,202,THB
ICC.R,"I.C.C. International Public Co., Ltd. NVDR",SET,Distribution Services,Wholesale Distributors,25.0,25.25,25.0,25.25,3.061224489795918,12625000000.0,200,THB
ICHI,"Ichitan Group Public Co., Ltd.",SET,Consumer Non-Durables,Food: Major Diversified,11.4,11.6,11.3,11.5,0.8771929824561372,14950000000.0,7150806,THB
ICHI.R,"Ichitan Group Public Co., Ltd. NVDR",SET,Consumer Non-Durables,Food: Major Diversified,11.4,11.6,11.3,11.5,0.8771929824561372,14950000000.0,7149300,THB
ICN,Information & Communication Networks Public Co. Ltd.,SET,Communications,Specialty Telecommunications,1.95,1.96,1.94,1.94,-0.5128205128205132,1303874938.0,300300,THB
ICN.R,Information & Communication Networks Public Co. Ltd. NVDR,SET,Communications,Specialty Telecommunications,1.95,1.96,1.94,1.94,-0.5128205128205132,1303874938.0,300300,THB
IFS,"IFS Capital (Thailand) Public Co., Ltd.",SET,Finance,Finance/Rental/Leasing,2.08,2.1,2.06,2.08,-0.9523809523809532,1026479898.9999999,20600,THB
IFS.R,"IFS Capital (Thailand) Public Co., Ltd. NVDR",SET,Finance,Finance/Rental/Leasing,2.08,2.1,2.06,2.08,-0.9523809523809532,1026479898.9999999,20600,THB
IHL,Interhides Public Co. Ltd.,SET,Producer Manufacturing,Auto Parts: OEM,1.6,1.61,1.58,1.59,-0.6250000000000006,942560858.0,27902,THB
IHL.R,Interhides Public Co. Ltd. NVDR,SET,Producer Manufacturing,Auto Parts: OEM,1.6,1.61,1.58,1.59,-0.6250000000000006,942560858.0,27900,THB
IIG,I&I Group Public Co Limited,SET,Commercial Services,Miscellaneous Commercial Services,1.95,2.02,1.92,1.96,1.5544041450777215,241818160.0,1571793,THB
IIG.R,I&I Group Public Co Limited NVDR,SET,Commercial Services,Miscellaneous Commercial Services,1.95,2.02,1.92,1.96,1.5544041450777215,241818160.0,1571700,THB
III,Triple i Logistics Public Company Limited,SET,Transportation,Air Freight/Couriers,4.82,4.9,4.82,4.84,1.2552301255230043,3308439059.0,262211,THB
III.R,Triple i Logistics Public Company Limited NVDR,SET,Transportation,Air Freight/Couriers,4.82,4.9,4.82,4.84,1.2552301255230043,3308439059.0,262200,THB
ILINK,"Interlink Communication Public Co., Ltd.",SET,Distribution Services,Electronics Distributors,4.9,4.94,4.88,4.92,0.40816326530611374,2600151273.0,356214,THB
ILINK.R,"Interlink Communication Public Co., Ltd. NVDR",SET,Distribution Services,Electronics Distributors,4.9,4.94,4.88,4.92,0.40816326530611374,2600151273.0,356200,THB
ILM,"Index Living Mall Public Co., Ltd.",SET,Retail Trade,Specialty Stores,14.5,14.6,14.5,14.6,0.6896551724137907,7373000193.0,103937,THB
ILM.R,Index Living Mall Co Ltd NVDR,SET,Retail Trade,Specialty Stores,14.5,14.6,14.5,14.6,0.6896551724137907,7373000193.0,103900,THB
IMH,Inter Medical Care & Lab Hospital PCL,SET,Health Services,Hospital/Nursing Management,4.26,4.36,4.16,4.2,-0.9433962264150951,995407517.0,530646,THB
IMH.R,Inter Medical Care & Lab Hospital PCL NVDR,SET,Health Services,Hospital/Nursing Management,4.26,4.36,4.16,4.2,-0.9433962264150951,995407517.0,530600,THB
IMPACT,IMPACT Growth Real Estate Investment Trust,SET,Finance,Real Estate Investment Trusts,9.8,9.85,9.8,9.85,0.0,14602625566.0,368144,THB
IND,Index International Group Public Co Limited,SET,Industrial Services,Engineering & Construction,1.15,1.24,1.15,1.2,4.347826086956526,420000000.0,3048200,THB
IND.R,Index International Group Public Co Limited NVDR,SET,Industrial Services,Engineering & Construction,1.15,1.24,1.15,1.2,4.347826086956526,420000000.0,3048200,THB
INDIA01,ChinaAMC MSCI India ETF Units Thailand Depositery Receipts Repr 0.01 Sh,SET,Miscellaneous,Investment Trusts/Mutual Funds,14.2,14.3,14.0,14.2,0.0,,166582,THB
INDIAESG19,iShares Southeast Asia Trust - iShares MSCI India Index ETF units Thailand Depository Receipt Repr 0.01 Sh,SET,Miscellaneous,Investment Trusts/Mutual Funds,4.48,4.52,4.42,4.46,-0.8888888888888897,,555316,THB
INET,Internet Thailand Public Co. Ltd.,SET,Technology Services,Information Technology Services,3.88,3.94,3.88,3.92,1.0309278350515474,2339221764.0,579393,THB
INET.R,Internet Thailand Public Co. Ltd. NVDR,SET,Technology Services,Information Technology Services,3.88,3.94,3.88,3.92,1.0309278350515474,2339221764.0,579300,THB
INETREIT,INET FREEHOLD AND LEASEHOLD REAL ESTATE INVESTMENT TRUST,SET,Finance,Real Estate Investment Trusts,10.0,10.1,9.95,10.0,0.0,3300000000.0,1552899,THB
INGRS,Ingress Industrial (Thailand) Public Company Limited,SET,Producer Manufacturing,Auto Parts: OEM,0.25,0.25,0.23,0.24,0.0,347266252.0,83600,THB
INGRS.R,Ingress Industrial (Thailand) Public Company Limited NVDR,SET,Producer Manufacturing,Auto Parts: OEM,0.25,0.25,0.23,0.24,0.0,347266252.0,83600,THB
INOX,POSCO-Thainox Public Co. Ltd.,SET,Non-Energy Minerals,Steel,0.41,0.42,0.4,0.42,2.4390243902439046,3274197671.0,1654500,THB
INOX.R,POSCO-Thainox Public Co. Ltd. NVDR,SET,Non-Energy Minerals,Steel,0.41,0.42,0.4,0.42,2.4390243902439046,3274197671.0,1654500,THB
INSET,"Infraset Public Co., Ltd.",SET,Technology Services,Data Processing Services,1.78,1.81,1.78,1.8,1.6949152542372896,1462991380.0,2777116,THB
INSET.R,"Infraset Public Co., Ltd. NVDR",SET,Technology Services,Data Processing Services,1.78,1.81,1.78,1.8,1.6949152542372896,1462991380.0,2777100,THB
INSURE,Indara Insurance Public Co. Ltd.,SET,Finance,Property/Casualty Insurance,72.25,72.25,72.25,72.25,-12.951807228915662,867000000.0,126,THB
INSURE.R,Indara Insurance Public Co. Ltd. NVDR,SET,Finance,Property/Casualty Insurance,72.25,72.25,72.25,72.25,-12.951807228915662,867000000.0,100,THB
