symbol,description,exchange,sector,industry,open,high,low,Close,Change%,MarketCap,Volume,Currency
NONGFU80,"Nongfu Spring Co., Ltd. Units Thailand Depositery Receipts Repr 0.01 Sh",SET,Consumer Non-Durables,Beverages: Non-Alcoholic,2.08,2.14,2.08,2.14,3.883495145631071,2375450601646.249,748010,THB
NOVA,"Nova Empire Public Co., Ltd.",SET,Producer Manufacturing,Metal Fabrication,10.0,10.0,10.0,10.0,0.0,1172312241.0,503,THB
NOVA.R,"Nova Empire Public Co., Ltd. NVDR",SET,Producer Manufacturing,Metal Fabrication,10.0,10.0,10.0,10.0,0.0,1172312241.0,500,THB
NOVOB80,Novo Nordisk A/S Units Thailand Depository Receipt Repr 0.001 Sh,SET,Health Technology,Pharmaceuticals: Major,1.81,1.81,1.77,1.8,-1.0989010989010999,7821345162240.802,2231378,THB
NPK,New Plus Knitting Public Co. Ltd.,SET,Consumer Non-Durables,Apparel/Footwear,12.8,14.3,12.8,14.3,10.852713178294577,143000002.0,4014,THB
NPK.R,New Plus Knitting Public Co. Ltd. NVDR,SET,Consumer Non-Durables,Apparel/Footwear,12.8,14.3,12.8,14.3,10.852713178294577,143000002.0,4000,THB
NSL,NSL Foods Public Company Limited,SET,Consumer Non-Durables,Food: Specialty/Candy,29.25,29.75,28.75,29.5,1.7241379310344827,8850000000.0,663780,THB
NSL.R,NSL Foods Public Company Limited NVDR,SET,Consumer Non-Durables,Food: Specialty/Candy,29.25,29.75,28.75,29.5,1.7241379310344827,8850000000.0,663700,THB
NTSC,Nutrition SC Public Company Limited,SET,Consumer Non-Durables,Food: Specialty/Candy,5.95,6.0,5.85,5.9,0.0,786664818.0,119501,THB
NTSC.R,Nutrition SC Public Company Limited NVDR,SET,Consumer Non-Durables,Food: Specialty/Candy,5.95,6.0,5.85,5.9,0.0,786664818.0,119500,THB
NTV,Nonthavej Hospital Public Co. Ltd.,SET,Health Services,Hospital/Nursing Management,25.0,25.0,24.9,24.9,-0.40000000000000563,3983999939.0,4445,THB
NTV.R,Nonthavej Hospital Public Co. Ltd. NVDR,SET,Health Services,Hospital/Nursing Management,25.0,25.0,24.9,24.9,-0.40000000000000563,3983999939.0,4400,THB
NUT,Nutrition Profess Public Company Limited,SET,Health Technology,Pharmaceuticals: Other,4.86,4.96,4.84,4.94,2.06611570247935,592800000.0,1160460,THB
NUT.R,Nutrition Profess Public Company Limited NVDR,SET,Health Technology,Pharmaceuticals: Other,4.86,4.96,4.84,4.94,2.06611570247935,,1160400,THB
NV,Nova Organic Public Company Limited,SET,Health Technology,Pharmaceuticals: Other,0.93,0.96,0.92,0.93,0.0,558000004.0,182705,THB
NV.R,Nova Organic Public Company Limited NVDR,SET,Health Technology,Pharmaceuticals: Other,0.93,0.96,0.92,0.93,0.0,558000004.0,182700,THB
NVD,Nirvana Development Public Company Limited,SET,Finance,Real Estate Development,0.9,0.91,0.9,0.91,1.111111111111112,1685230404.0,2511,THB
NVD.R,Nirvana Development Public Company Limited NVDR,SET,Finance,Real Estate Development,0.9,0.91,0.9,0.91,1.111111111111112,1685230404.0,2500,THB
NVDA01,NVIDIA Corporation Units Thailand Depository Receipt Repr 0.1 Sh,SET,Electronic Technology,Semiconductors,16.2,16.2,15.5,15.7,-3.680981595092033,131303335613749.6,398116,THB
NVDA19,NVIDIA Corporation Units Thailand Depositery Receipts Repr 0.01 Sh,SET,Electronic Technology,Semiconductors,22.0,22.0,21.1,21.4,-3.1674208144796503,131303335613749.6,84776,THB
NVDA80,NVIDIA Corporation Units Thailand Depository Receipt Repr 0.01 Sh,SET,Electronic Technology,Semiconductors,27.5,27.5,26.25,26.5,-4.504504504504505,131303335613749.6,1090874,THB
NYT,Namyong Terminal Public Co. Ltd.,SET,Transportation,Marine Shipping,2.84,2.86,2.82,2.86,0.7042253521126767,3546400166.0,1321319,THB
NYT.R,Namyong Terminal Public Co. Ltd. NVDR,SET,Transportation,Marine Shipping,2.84,2.86,2.82,2.86,0.7042253521126767,3546400166.0,1321200,THB
OCC,OCC Public Co. Ltd.,SET,Distribution Services,Medical Distributors,9.1,9.1,9.1,9.1,-0.5464480874317017,546000023.0,100,THB
OCC.R,OCC Public Co. Ltd. NVDR,SET,Distribution Services,Medical Distributors,9.1,9.1,9.1,9.1,-0.5464480874317017,546000023.0,100,THB
OGC,"Ocean Glass Public Co., Ltd.",SET,Process Industries,Containers/Packaging,10.4,10.4,9.85,9.85,-5.288461538461545,210107571.0,4500,THB
OGC.R,"Ocean Glass Public Co., Ltd. NVDR",SET,Process Industries,Containers/Packaging,10.4,10.4,9.85,9.85,-5.288461538461545,210107571.0,4500,THB
OHTL,OHTL Public Co. Ltd.,SET,Consumer Services,Hotels/Resorts/Cruise lines,285.0,285.0,285.0,285.0,1.7857142857142856,4302873073.0,200,THB
OHTL.R,OHTL Public Co. Ltd. NVDR,SET,Consumer Services,Hotels/Resorts/Cruise lines,285.0,285.0,285.0,285.0,1.7857142857142856,4302873073.0,200,THB
OIL03,Global X S&P Crude Oil Futures Enhanced ER ETF Units Thailand Depositery Receipts Repr 0.01 Sh,SET,Miscellaneous,Investment Trusts/Mutual Funds,2.08,2.1,2.08,2.1,0.9615384615384623,,11107,THB
OKJ,Pluk Phak Praw Rak Mae Public Company Limited,SET,Consumer Services,Restaurants,5.85,6.1,5.8,6.05,5.217391304347823,3684450000.0,4338169,THB
OKJ.R,Pluk Phak Praw Rak Mae Public Company Limited NVDR,SET,Consumer Services,Restaurants,5.85,6.1,5.8,6.05,5.217391304347823,3684450000.0,4337500,THB
ONEE,One Enterprise Public Co. Ltd.,SET,Consumer Services,Movies/Entertainment,2.32,2.32,2.28,2.3,0.0,5476874886.0,155106,THB
ONEE.R,One Enterprise Public Co. Ltd. NVDR,SET,Consumer Services,Movies/Entertainment,2.32,2.32,2.28,2.3,0.0,5476874886.0,155000,THB
OR,PTT Oil and Retail Business Public Co Limited,SET,Distribution Services,Wholesale Distributors,14.0,14.4,13.9,14.4,4.347826086956519,172799995422.0,61773385,THB
OR.F,PTT Oil and Retail Business Public Co Limited(Alien Mkt),SET,Distribution Services,Wholesale Distributors,12.6,12.7,12.6,12.7,-1.5503875968992331,172799995422.0,238300,THB
OR.R,PTT Oil and Retail Business Public Co Limited NVDR,SET,Distribution Services,Wholesale Distributors,14.0,14.4,13.9,14.4,4.347826086956519,172799995422.0,61768900,THB
ORI,Origin Property Public Company Ltd,SET,Consumer Durables,Homebuilding,2.28,2.44,2.24,2.42,8.035714285714272,5938976779.0,22585406,THB
ORI.R,Origin Property Public Company Ltd NVDR,SET,Consumer Durables,Homebuilding,2.28,2.44,2.24,2.42,8.035714285714272,5938976779.0,22584900,THB
ORN,ORNSIRIN HOLDING PUBLIC COMPANY LIMITED,SET,Finance,Real Estate Development,0.71,0.71,0.7,0.71,0.0,1065000000.0,483300,THB
ORN.R,ORNSIRIN HOLDING PUBLIC COMPANY LIMITED NVDR,SET,Finance,Real Estate Development,0.71,0.71,0.7,0.71,0.0,1065000000.0,483300,THB
OSP,Osotspa Public Co. Ltd.,SET,Consumer Non-Durables,Beverages: Non-Alcoholic,17.4,17.9,17.2,17.6,2.32558139534885,52866001146.0,12443047,THB
OSP.R,Osotspa Public Co. Ltd. NVDR,SET,Consumer Non-Durables,Beverages: Non-Alcoholic,17.4,17.9,17.2,17.6,2.32558139534885,52866001146.0,12442100,THB
PACO,"President Automobile Industries Public Co., Ltd.",SET,Producer Manufacturing,Industrial Machinery,1.37,1.39,1.37,1.39,0.724637681159421,1389999986.0,139101,THB
PACO.R,"President Automobile Industries Public Co., Ltd. NVDR",SET,Producer Manufacturing,Industrial Machinery,1.37,1.39,1.37,1.39,0.724637681159421,1389999986.0,139100,THB
PAF,Pan Asia Footwear Public Co. Ltd.,SET,Consumer Non-Durables,Apparel/Footwear,0.94,0.96,0.92,0.92,-5.154639175257725,493489154.0,276103,THB
PAF.R,Pan Asia Footwear Public Co. Ltd. NVDR,SET,Consumer Non-Durables,Apparel/Footwear,0.94,0.96,0.92,0.92,-5.154639175257725,493489154.0,276100,THB
PANEL,Panelesmatic Solutions PCL,SET,Producer Manufacturing,Building Products,1.29,1.31,1.28,1.29,0.0,245100000.0,97601,THB
PANEL.R,Panelesmatic Solutions PCL NVDR,SET,Producer Manufacturing,Building Products,1.29,1.31,1.28,1.29,0.0,,97600,THB
PAP,"Pacific Pipe Public Co., Ltd.",SET,Non-Energy Minerals,Steel,1.76,1.8,1.76,1.78,1.1363636363636374,1174799981.0,77700,THB
PAP.R,"Pacific Pipe Public Co., Ltd. NVDR",SET,Non-Energy Minerals,Steel,1.76,1.8,1.76,1.78,1.1363636363636374,1174799981.0,77700,THB
PATO,Pato Chemical Industries Public Co. Ltd.,SET,Process Industries,Chemicals: Agricultural,8.3,8.4,8.3,8.4,-0.5917159763313483,1195924695.0,11101,THB
PATO.R,Pato Chemical Industries Public Co. Ltd. NVDR,SET,Process Industries,Chemicals: Agricultural,8.3,8.4,8.3,8.4,-0.5917159763313483,1195924695.0,11100,THB
PB,"President Bakery Public Co., Ltd.",SET,Consumer Non-Durables,Food: Specialty/Candy,49.5,50.0,49.5,50.0,0.0,22500000000.0,610,THB
PB.R,"President Bakery Public Co., Ltd. NVDR",SET,Consumer Non-Durables,Food: Specialty/Candy,49.5,50.0,49.5,50.0,0.0,22500000000.0,600,THB
PCC,Precise Corporation Public Company Limited,SET,Electronic Technology,Electronic Equipment/Instruments,2.6,2.6,2.58,2.6,0.0,3189209660.0,141100,THB
PCC.R,Precise Corporation Public Company Limited NVDR,SET,Electronic Technology,Electronic Equipment/Instruments,2.6,2.6,2.58,2.6,0.0,3189209660.0,141100,THB
PCE,Petchsrivichai Enterprise Public Company Limited,SET,Process Industries,Agricultural Commodities/Milling,2.46,2.5,2.44,2.46,0.0,6765000000.0,750593,THB
PCE.R,Petchsrivichai Enterprise Public Company Limited NVDR,SET,Process Industries,Agricultural Commodities/Milling,2.46,2.5,2.44,2.46,0.0,6765000000.0,750500,THB
PCSGH,P.C.S. Machine Group Holding Public Company Ltd,SET,Producer Manufacturing,Auto Parts: OEM,3.04,3.06,3.02,3.06,1.3245033112582794,4666499913.0,46499,THB
PCSGH.R,P.C.S. Machine Group Holding Public Company Ltd NVDR,SET,Producer Manufacturing,Auto Parts: OEM,3.04,3.06,3.02,3.06,1.3245033112582794,4666499913.0,46400,THB
PDG,Prodigy Public Co. Ltd.,SET,Producer Manufacturing,Miscellaneous Manufacturing,2.72,2.74,2.72,2.74,0.7352941176470594,813780003.0,31900,THB
PDG.R,Prodigy Public Co. Ltd. NVDR,SET,Producer Manufacturing,Miscellaneous Manufacturing,2.72,2.74,2.72,2.74,0.7352941176470594,813780003.0,31900,THB
PDJ,Pranda Jewelry Public Co. Ltd.,SET,Consumer Durables,Other Consumer Specialties,1.32,1.34,1.31,1.32,0.7633587786259549,782666584.0,36300,THB
PDJ.R,Pranda Jewelry Public Co. Ltd. NVDR,SET,Consumer Durables,Other Consumer Specialties,1.32,1.34,1.31,1.32,0.7633587786259549,782666584.0,36300,THB
PEACE,Peace & Living Public Company Limited,SET,Finance,Real Estate Development,2.04,2.04,2.0,2.04,0.0,1028159981.0,17202,THB
PEACE.R,Peace & Living Public Company Limited NVDR,SET,Finance,Real Estate Development,2.04,2.04,2.0,2.04,0.0,1028159981.0,17200,THB
PEER,PEER FOR YOU PUBLIC COMPANY LIMITED,SET,Commercial Services,Miscellaneous Commercial Services,0.11,0.11,0.1,0.11,0.0,116041916.0,786505,THB
PEER.R,PEER FOR YOU PUBLIC COMPANY LIMITED NVDR,SET,Commercial Services,Miscellaneous Commercial Services,0.11,0.11,0.1,0.11,0.0,116041916.0,786500,THB
PEP80,"PepsiCo, Inc. Units Thailand Depository Receipt Repr 0.0002 Sh",SET,Consumer Non-Durables,Food: Specialty/Candy,0.95,0.95,0.94,0.95,-1.0416666666666676,6483960556260.11,436801,THB
PERM,"Permsin Steel Works Public Co., Ltd.",SET,Non-Energy Minerals,Steel,0.34,0.34,0.32,0.34,0.0,256820198.0,1562014,THB
PERM.R,"Permsin Steel Works Public Co., Ltd. NVDR",SET,Non-Energy Minerals,Steel,0.34,0.34,0.32,0.34,0.0,256820198.0,1561900,THB
PF,Property Perfect Public Co. Ltd.,SET,Finance,Real Estate Development,0.08,0.09,0.08,0.08,0.0,800907091.0,12636330,THB
PF.R,Property Perfect Public Co. Ltd. NVDR,SET,Finance,Real Estate Development,0.08,0.09,0.08,0.08,0.0,800907091.0,12636300,THB
PFIZER19,Pfizer Inc. Units Thailand Depositery Receipts Repr 0.01 Sh,SET,Health Technology,Pharmaceuticals: Major,15.9,15.9,15.8,15.9,0.0,4576398787382.724,10803,THB
PG,"People's Garment Public Co., Ltd.",SET,Consumer Non-Durables,Apparel/Footwear,7.15,7.3,7.1,7.3,4.285714285714283,700800018.0,701,THB
PG.R,"People's Garment Public Co., Ltd. NVDR",SET,Consumer Non-Durables,Apparel/Footwear,7.15,7.3,7.1,7.3,4.285714285714283,700800018.0,700,THB
PHG,Patrangsit Healthcare Group Public Company Limited,SET,Health Services,Hospital/Nursing Management,14.4,14.4,14.2,14.4,0.0,4320000000.0,65402,THB
PHG.R,Patrangsit Healthcare Group Public Company Limited NVDR,SET,Health Services,Hospital/Nursing Management,14.4,14.4,14.2,14.4,0.0,4320000000.0,65400,THB
PHOL,"Phol Dhanya Public Co., Ltd.",SET,Distribution Services,Wholesale Distributors,2.76,2.78,2.74,2.76,0.0,558900588.0,82277,THB
PHOL.R,"Phol Dhanya Public Co., Ltd. NVDR",SET,Distribution Services,Wholesale Distributors,2.76,2.78,2.74,2.76,0.0,558900588.0,82200,THB
PICO,Pico Thailand Public Co. Ltd.,SET,Commercial Services,Miscellaneous Commercial Services,3.96,3.96,3.94,3.96,1.5384615384615399,852566449.0,1200,THB
PICO.R,Pico Thailand Public Co. Ltd. NVDR,SET,Commercial Services,Miscellaneous Commercial Services,3.96,3.96,3.94,3.96,1.5384615384615399,852566449.0,1200,THB
PIMO,Pioneer Motor Public Company Limited,SET,Producer Manufacturing,Electrical Products,1.04,1.07,1.03,1.03,0.0,687959889.0,966601,THB
PIMO.R,Pioneer Motor Public Company Limited NVDR,SET,Producer Manufacturing,Electrical Products,1.04,1.07,1.03,1.03,0.0,687959889.0,966600,THB
PIN,Pinthong Industrial Park Public Company Limited,SET,Finance,Real Estate Development,4.22,4.46,4.22,4.44,5.213270142180111,5150400066.0,1183413,THB
PIN.R,Pinthong Industrial Park Public Company Limited NVDR,SET,Finance,Real Estate Development,4.22,4.46,4.22,4.44,5.213270142180111,5150400066.0,1183400,THB
PINGAN01,"Ping An Insurance (Group) Company of China, Ltd. Units Thailand Depository Receipt Repr 0.1 Sh",SET,Finance,Multi-Line Insurance,5.2,5.25,5.15,5.25,0.0,4488442224699.765,14502,THB
PINGAN80,"Ping An Insurance (Group) Company of China, Ltd. Units Thailand Depository Receipt Repr 0.01 Sh",SET,Finance,Multi-Line Insurance,2.28,2.3,2.26,2.28,-1.7241379310344844,4488442224699.765,8872721,THB
PIS,Pro Inside Public Company Limited,SET,Commercial Services,Miscellaneous Commercial Services,3.9,3.96,3.9,3.9,0.5154639175257737,2106000000.0,62201,THB
PIS.R,Pro Inside Public Company Limited NVDR,SET,Commercial Services,Miscellaneous Commercial Services,3.9,3.96,3.9,3.9,0.5154639175257737,,62200,THB
PJW,Panjawattana Plastic Public Co. Ltd.,SET,Process Industries,Containers/Packaging,2.08,2.12,2.06,2.1,0.9615384615384623,1310535292.0,71550,THB
PJW.R,Panjawattana Plastic Public Co. Ltd. NVDR,SET,Process Industries,Containers/Packaging,2.08,2.12,2.06,2.1,0.9615384615384623,1310535292.0,71500,THB
PK,PATKOL Public Co. Ltd.,SET,Producer Manufacturing,Industrial Machinery,0.58,0.59,0.57,0.57,-1.7241379310344844,296831080.0,204900,THB
PK.R,PATKOL Public Co. Ltd. NVDR,SET,Producer Manufacturing,Industrial Machinery,0.58,0.59,0.57,0.57,-1.7241379310344844,296831080.0,204900,THB
PL,"Phatra Leasing Public Co., Ltd.",SET,Finance,Finance/Rental/Leasing,1.26,1.28,1.25,1.26,0.8000000000000007,751602376.0,419200,THB
PL.R,"Phatra Leasing Public Co., Ltd. NVDR",SET,Finance,Finance/Rental/Leasing,1.26,1.28,1.25,1.26,0.8000000000000007,751602376.0,419200,THB
PLANB,Plan B Media Public Company Ltd,SET,Commercial Services,Advertising/Marketing Services,4.84,5.2,4.8,5.05,5.208333333333334,23231411327.0,63259202,THB
PLANB.R,Plan B Media Public Company Ltd NVDR,SET,Commercial Services,Advertising/Marketing Services,4.84,5.2,4.8,5.05,5.208333333333334,23231411327.0,63258200,THB
PLANET,Planet Communications Asia Public Co. Ltd.,SET,Distribution Services,Electronics Distributors,1.69,1.7,1.66,1.7,0.0,1120791541.0,369100,THB
PLANET.R,Planet Communications Asia Public Co. Ltd. NVDR,SET,Distribution Services,Electronics Distributors,1.69,1.7,1.66,1.7,0.0,1120791541.0,369100,THB
PLAT,Platinum Group Public Co. Ltd.,SET,Finance,Real Estate Development,1.05,1.07,1.04,1.06,1.9230769230769247,2967999840.0,3759700,THB
PLAT.R,Platinum Group Public Co. Ltd. NVDR,SET,Finance,Real Estate Development,1.05,1.07,1.04,1.06,1.9230769230769247,2967999840.0,3759700,THB
PLE,"Power Line Engineering Public Co., Ltd.",SET,Industrial Services,Engineering & Construction,0.22,0.22,0.21,0.21,0.0,381309001.0,5035100,THB
PLE.R,"Power Line Engineering Public Co., Ltd. NVDR",SET,Industrial Services,Engineering & Construction,0.22,0.22,0.21,0.21,0.0,381309001.0,5035000,THB
PLT,Pilatus Marine Public Company Limited,SET,Utilities,Gas Distributors,0.58,0.58,0.57,0.58,0.0,556800000.0,293400,THB
PLT.R,Pilatus Marine Public Company Limited NVDR,SET,Utilities,Gas Distributors,0.58,0.58,0.57,0.58,0.0,556800000.0,293400,THB
PLUS,Royal Plus Public Company Limited,SET,Consumer Non-Durables,Beverages: Non-Alcoholic,2.9,2.92,2.88,2.92,1.3888888888888902,1956400051.0,64148,THB
PLUS.R,Royal Plus Public Company Limited NVDR,SET,Consumer Non-Durables,Beverages: Non-Alcoholic,2.9,2.92,2.88,2.92,1.3888888888888902,1956400051.0,64100,THB
PM,Premier Marketing Public Co. Ltd.,SET,Distribution Services,Food Distributors,11.9,12.1,11.9,12.0,0.8403361344537785,6697439941.0,284808,THB
PM.R,Premier Marketing Public Co. Ltd. NVDR,SET,Distribution Services,Food Distributors,11.9,12.1,11.9,12.0,0.8403361344537785,6697439941.0,284500,THB
PMC,"PMC Label Materials Public Co., Ltd.",SET,Process Industries,Containers/Packaging,1.01,1.02,1.0,1.0,0.0,395863040.0,1946900,THB
PMC.R,"PMC Label Materials Public Co., Ltd. NVDR",SET,Process Industries,Containers/Packaging,1.01,1.02,1.0,1.0,0.0,395863040.0,1946900,THB
PMTA,PM Thoresen Asia Holdings Public Company Limited,SET,Process Industries,Chemicals: Agricultural,10.0,10.1,10.0,10.1,0.9999999999999963,1022120008.0,528,THB
PMTA.R,PM Thoresen Asia Holdings Public Company Limited NVDR,SET,Process Industries,Chemicals: Agricultural,10.0,10.1,10.0,10.1,0.9999999999999963,1022120008.0,500,THB
POLY,Polynet Public Company Limited,SET,Process Industries,Chemicals: Specialty,7.2,7.2,7.05,7.05,-2.083333333333338,3172500000.0,400,THB
POLY.R,Polynet Public Company Limited NVDR,SET,Process Industries,Chemicals: Specialty,7.2,7.2,7.05,7.05,-2.083333333333338,3172500000.0,400,THB
POPF,Prime Office Leasehold Property Fund Units,SET,Finance,Real Estate Investment Trusts,6.1,6.15,6.05,6.15,0.8196721311475527,2962079850.0,317734,THB
POPMART80,Pop Mart International Group Limited Units Thailand Depositery Receipts Repr 0.01 Sh,SET,Consumer Services,Movies/Entertainment,12.7,12.9,12.5,12.9,1.574803149606308,1704659337627.162,1321255,THB
PORT,Sahathai Terminal Public Company Limited,SET,Transportation,Other Transportation,0.8,0.84,0.78,0.8,1.2658227848101276,485759968.0,1101467,THB
PORT.R,Sahathai Terminal Public Company Limited NVDR,SET,Transportation,Other Transportation,0.8,0.84,0.78,0.8,1.2658227848101276,485759968.0,1101400,THB
PPM,"Porn Prom Metal Public Co., Ltd.",SET,Non-Energy Minerals,Steel,1.51,1.52,1.5,1.51,-0.6578947368421059,637221102.0,23870,THB
PPM.R,"Porn Prom Metal Public Co., Ltd. NVDR",SET,Non-Energy Minerals,Steel,1.51,1.52,1.5,1.51,-0.6578947368421059,637221102.0,23700,THB
PPP,Premier Products Public Co. Ltd.,SET,Industrial Services,Engineering & Construction,1.14,1.16,1.14,1.14,-1.7241379310344844,341999996.0,60502,THB
PPP.R,Premier Products Public Co. Ltd. NVDR,SET,Industrial Services,Engineering & Construction,1.14,1.16,1.14,1.14,-1.7241379310344844,341999996.0,60500,THB
PPPM,"PP PRIME Public Co., Ltd.",SET,Process Industries,Agricultural Commodities/Milling,0.43,0.44,0.42,0.43,0.0,347927929.0,422900,THB
PPPM.R,"PP PRIME Public Co., Ltd. NVDR",SET,Process Industries,Agricultural Commodities/Milling,0.43,0.44,0.42,0.43,0.0,347927929.0,422900,THB
PPS,Project Planning Service PCL,SET,Industrial Services,Engineering & Construction,0.27,0.27,0.25,0.26,-3.703703703703707,223562334.0,2061400,THB
PPS.R,Project Planning Service PCL NVDR,SET,Industrial Services,Engineering & Construction,0.27,0.27,0.25,0.26,-3.703703703703707,223562334.0,2061400,THB
PQS,Premier Quality Starch Public Company Limited,SET,Process Industries,Agricultural Commodities/Milling,2.0,2.02,1.99,2.02,1.0000000000000009,1353400000.0,358701,THB
PQS.R,Premier Quality Starch Public Company Limited NVDR,SET,Process Industries,Agricultural Commodities/Milling,2.0,2.02,1.99,2.02,1.0000000000000009,1353400000.0,358700,THB
PR9,Praram 9 Hospital Public Co Limited,SET,Health Services,Hospital/Nursing Management,22.4,22.7,22.4,22.4,0.0,17613120794.0,950553,THB
PR9.R,Praram 9 Hospital Public Co Limited NVDR,SET,Health Services,Hospital/Nursing Management,22.4,22.7,22.4,22.4,0.0,17613120794.0,950400,THB
PRAKIT,Prakit Holdings Public Company Limited,SET,Commercial Services,Advertising/Marketing Services,10.8,10.8,10.8,10.8,-0.9174311926605472,652862862.0,700,THB
PRAKIT.R,Prakit Holdings Public Company Limited NVDR,SET,Commercial Services,Advertising/Marketing Services,10.8,10.8,10.8,10.8,-0.9174311926605472,652862862.0,700,THB
PRAPAT,Peerapat Technology Public Company Limited,SET,Consumer Non-Durables,Household/Personal Care,0.83,0.84,0.82,0.82,-2.380952380952383,350840981.0,1954744,THB
PRAPAT.R,Peerapat Technology Public Company Limited NVDR,SET,Consumer Non-Durables,Household/Personal Care,0.83,0.84,0.82,0.82,-2.380952380952383,350840981.0,1954600,THB
PREB,Pre-Built Public Co. Ltd.,SET,Consumer Durables,Homebuilding,3.64,3.64,3.56,3.62,0.0,1117408723.0,20200,THB
PREB.R,Pre-Built Public Co. Ltd. NVDR,SET,Consumer Durables,Homebuilding,3.64,3.64,3.56,3.62,0.0,1117408723.0,20200,THB
PRECHA,Preecha Group Public Co. Ltd.,SET,Finance,Real Estate Development,0.65,0.75,0.65,0.74,4.2253521126760605,248640003.0,20610,THB
PRECHA.R,Preecha Group Public Co. Ltd. NVDR,SET,Finance,Real Estate Development,0.65,0.75,0.65,0.74,4.2253521126760605,248640003.0,20600,THB
PRG,PRG Corporation Public Company Limited,SET,Process Industries,Agricultural Commodities/Milling,8.3,8.35,8.3,8.35,1.2121212121212077,6370878541.0,72689,THB
PRG.R,PRG Corporation Public Company Limited NVDR,SET,Process Industries,Agricultural Commodities/Milling,8.3,8.35,8.3,8.35,1.2121212121212077,6370878541.0,72600,THB
PRI,Primo Service Solutions PCL,SET,Finance,Real Estate Development,4.86,4.86,4.7,4.78,0.0,1529599915.0,633502,THB
PRI.R,Primo Service Solutions PCL NVDR,SET,Finance,Real Estate Development,4.86,4.86,4.7,4.78,0.0,1529599915.0,633500,THB
PRIME,Prime Road Power Public Co. Ltd.,SET,Utilities,Alternative Power Generation,0.08,0.09,0.08,0.08,0.0,340358821.0,9987975,THB
PRIME.R,Prime Road Power Public Co. Ltd. NVDR,SET,Utilities,Alternative Power Generation,0.08,0.09,0.08,0.08,0.0,340358821.0,9987900,THB
PRIN,Prinsiri Public Co. Ltd.,SET,Consumer Durables,Homebuilding,1.5,1.51,1.5,1.51,-2.5806451612903247,1842217684.0,4002,THB
PRIN.R,Prinsiri Public Co. Ltd. NVDR,SET,Consumer Durables,Homebuilding,1.5,1.51,1.5,1.51,-2.5806451612903247,1842217684.0,4000,THB
PRINC,Principal Capital Public Co. Ltd.,SET,Health Services,Hospital/Nursing Management,2.0,2.02,2.0,2.02,1.0000000000000009,7693312452.0,215105,THB
PRINC.R,Principal Capital Public Co. Ltd. NVDR,SET,Health Services,Hospital/Nursing Management,2.0,2.02,2.0,2.02,1.0000000000000009,7693312452.0,215100,THB
PRM,Prima Marine Public Company Ltd,SET,Distribution Services,Wholesale Distributors,6.45,6.55,6.45,6.55,1.5503875968992191,16375000477.0,5581054,THB
PRM.R,Prima Marine Public Co. Ltd. NVDR,SET,Distribution Services,Wholesale Distributors,6.45,6.55,6.45,6.55,1.5503875968992191,16375000477.0,5580900,THB
PROEN,PROEN Corp Public Company Limited,SET,Technology Services,Internet Software/Services,1.53,1.55,1.46,1.46,-4.575163398692815,573149374.0,21955011,THB
PROEN.R,PROEN Corp Public Company Limited NVDR,SET,Technology Services,Internet Software/Services,1.53,1.55,1.46,1.46,-4.575163398692815,573149374.0,21955000,THB
PROS,Prosper Engineering Public Company Limited,SET,Industrial Services,Engineering & Construction,0.62,0.63,0.61,0.61,0.0,329400008.0,933200,THB
PROS.R,Prosper Engineering Public Company Limited NVDR,SET,Industrial Services,Engineering & Construction,0.62,0.63,0.61,0.61,0.0,329400008.0,933200,THB
PROSPECT,PROSPECT LOGISTICS AND INDUSTRIAL FREEHOLDAND LEASEHOLD REAL ESTATE INVESTMENT TRUST,SET,Finance,Real Estate Investment Trusts,7.2,7.2,7.15,7.15,-0.694444444444442,4604600061.0,164535,THB
PROUD,Proud Real Estate Public Co. Ltd.,SET,Finance,Real Estate Development,1.07,1.13,1.07,1.08,1.8867924528301903,692786607.0,695500,THB
PROUD.R,Proud Real Estate Public Co. Ltd. NVDR,SET,Finance,Real Estate Development,1.07,1.13,1.07,1.08,1.8867924528301903,692786607.0,695500,THB
PRTR,PRTR Group PCL,SET,Commercial Services,Personnel Services,3.64,3.66,3.64,3.66,0.5494505494505499,2196000000.0,552800,THB
PRTR.R,PRTR Group PCL NVDR,SET,Commercial Services,Personnel Services,3.64,3.66,3.64,3.66,0.5494505494505499,2196000000.0,552800,THB
PSG,PSG Corporation Public Company Limited,SET,Industrial Services,Engineering & Construction,1.18,1.2,1.17,1.18,1.7241379310344844,19172771300.0,4361801,THB
PSG.R,PSG Corporation Public Company Limited NVDR,SET,Industrial Services,Engineering & Construction,1.18,1.2,1.17,1.18,1.7241379310344844,19172771300.0,4361600,THB
PSH,Pruksa Holding PCL,SET,Finance,Real Estate Development,4.24,4.38,4.24,4.38,3.7914691943128,9585650568.0,699497,THB
PSH.R,Pruksa Holding Public Company Ltd NVDR,SET,Finance,Real Estate Development,4.24,4.38,4.24,4.38,3.7914691943128,9585650568.0,699400,THB
PSL,"Precious Shipping Public Co., Ltd.",SET,Transportation,Marine Shipping,6.35,6.45,6.3,6.35,0.0,9901503227.0,2403831,THB
PSL.R,"Precious Shipping Public Co., Ltd. NVDR",SET,Transportation,Marine Shipping,6.35,6.45,6.3,6.35,0.0,9901503227.0,2403700,THB
PSP,PSP Specialties Public Company Limited,SET,Process Industries,Industrial Specialties,4.92,5.05,4.92,5.05,2.6422764227642253,7070000267.0,61000,THB
PSP.F,PSP Specialties Public Company Limited (Alien Mkt),SET,Process Industries,Industrial Specialties,2.0,4.92,2.0,4.92,0.0,7070000267.0,2000,THB
PSP.R,PSP Specialties Public Company Limited NVDR,SET,Process Industries,Industrial Specialties,4.92,5.05,4.92,5.05,2.6422764227642253,7070000267.0,61000,THB
PSTC,Power Solution Technologies Public Co. Ltd.,SET,Utilities,Electric Utilities,0.39,0.39,0.38,0.39,2.6315789473684235,1351224457.0,1090803,THB
PSTC.R,Power Solution Technologies Public Co. Ltd. NVDR,SET,Utilities,Electric Utilities,0.39,0.39,0.38,0.39,2.6315789473684235,1351224457.0,1090800,THB
